com.flyrobe.android	35	2.2.4	en	condor_umtsds	2017-03-07T11:23:58Z	1488885838181	2017-03-07T11:24:07Z	1488885847689	5		application for on-line at the global offerings at is sincerely amazingly first rate and endorsed				https://play.google.com/apps/publish?account=6499663341265583899#ReviewDetailsPlace:p=com.flyrobe.android&reviewid=gp:AOqpTOFPH7cvKB224oZcEzAU9XaPGuppaSXWK_NTFWItmP0VvE76yvI4SNUfxnw03ngKhgRAP7d8E1dHdg29bg
com.flyrobe.android	35	2.2.4	en	Q417	2017-03-07T11:25:52Z	1488885952675	2017-03-07T11:26:02Z	1488885962937	5		Many other programs like roposo are not as appropriate as this one this application is totally superb and that they offer loads of offerings so without problems				https://play.google.com/apps/publish?account=6499663341265583899#ReviewDetailsPlace:p=com.flyrobe.android&reviewid=gp:AOqpTOHpzwcjZE9sLmZUzIlzFIj-1sWQaqOrGrvGVOzWBb4myDVP2qt5SSAA8pFnGjafeXDY2PeWMYT0dfr_rw
com.flyrobe.android	35	2.2.4	en	HM2014818	2017-03-07T11:28:27Z	1488886107361	2017-03-07T11:28:35Z	1488886115117	5		region the user interface is certainly cool you would genuinely love to uses application over and over				https://play.google.com/apps/publish?account=6499663341265583899#ReviewDetailsPlace:p=com.flyrobe.android&reviewid=gp:AOqpTOEk2VaV9-K8U8ky57K1tjfF143tAp15kLdihJ8eM1NOIdOqxxwrOHhxVcOY2-V3aAVjlKLSHxiLAHeEyQ
com.flyrobe.android			en	HGO	2017-03-07T11:32:17Z	1488886337217	2017-03-07T11:32:36Z	1488886356994	5		i bought a formal shirt from the koovs shopping app , and when it was delivered to me it had some problem with the size , later i had to return it .then one of , then one of my friend told me to check the flyrobe shopping app ,then i checked the flyrobe app and there i could find a good looking formal shirt , and i could have it just have it paying the rent .nice app the flyrobe is .				https://play.google.com/apps/publish?account=6499663341265583899#ReviewDetailsPlace:p=com.flyrobe.android&reviewid=gp:AOqpTOE3N9cIzJ_18opBniuj6Zoe5ts0-ilsJb_A-CVtdbtbNpgD0FaV98NHXIdHx_fetQd5GmdLC07RPwV2cg
com.flyrobe.android	35	2.2.4	en	A68	2017-03-07T11:30:45Z	1488886245042	2017-03-07T11:36:39Z	1488886599212	5		The very nice packages that you must cross for it has all the things no greater transport so just absolutely surprised				https://play.google.com/apps/publish?account=6499663341265583899#ReviewDetailsPlace:p=com.flyrobe.android&reviewid=gp:AOqpTOGFsiDq1A9huHdN1OL-TEnN6mG7jvAuMwFM8x-YwBOiMo42eAy97nhMsq_2ui-_bX9Z4_wzQLhqG4F81g
com.flyrobe.android	35	2.2.4	en	IrisFuelF1	2017-03-07T11:37:48Z	1488886668996	2017-03-07T11:38:01Z	1488886681181	5		i love you this application over and over I absolutely advocate you to makes use of application to definitely a laugh and wonderful utility to use				https://play.google.com/apps/publish?account=6499663341265583899#ReviewDetailsPlace:p=com.flyrobe.android&reviewid=gp:AOqpTOHLcI-yoEHpjyY8TcWhibNQIpncx-bHztMbDF0T07p_yU7aX_rGDeB-UsHfMdnZ0nspwKP1y6G9logtBg
com.flyrobe.android	35	2.2.4	en	j2lte	2017-03-07T11:42:37Z	1488886957270	2017-03-07T11:43:41Z	1488887021550	5		one of the very satisfactory platforms for purchasing in renting material on-line this software is certainly tremendous to get all the matters which you need so easily				https://play.google.com/apps/publish?account=6499663341265583899#ReviewDetailsPlace:p=com.flyrobe.android&reviewid=gp:AOqpTOH6KZbKgcQ5LKqFgoh9zBYW9xNrj24qjGuD3_gpXUlBiyQa-OoH-yb2RaV6qqGcqOCnK5di4q9ybk1GRA
com.flyrobe.android	35	2.2.4	en	osprey_ud2	2017-03-07T11:43:45Z	1488887025231	2017-03-07T11:44:37Z	1488887077476	5		first rate in terms of providing all the services they're virtually better than many different packages like roposo				https://play.google.com/apps/publish?account=6499663341265583899#ReviewDetailsPlace:p=com.flyrobe.android&reviewid=gp:AOqpTOEcrxCnLUs1FU9IiwS99o-bkFsQEHRykl6gZoUa2H3R6hz3KkK5EQx2Y37lc_OJPqtn4mneHDdOltsiGg
com.flyrobe.android	35	2.2.4	en	E481	2017-03-07T11:44:56Z	1488887096915	2017-03-07T11:45:05Z	1488887105097	5		Make it clearly simple to makes use of software once you begin the use of it assure you which you might not move for any other software for on line and inform offerings				https://play.google.com/apps/publish?account=6499663341265583899#ReviewDetailsPlace:p=com.flyrobe.android&reviewid=gp:AOqpTOFdt-B2oCh74XETet6m2LVo7X9vTZjpO5dVzpik11gvRiUJZKVffaOyorB8GEqJv2ilpJneiVDwsLATtA
com.flyrobe.android	35	2.2.4	en	CPY83_I00	2017-03-07T11:54:16Z	1488887656909	2017-03-07T11:54:21Z	1488887661338	5		very good software with lots of deals And reductions to be had from time to time you need no longer pass for some other application for getting online studies				https://play.google.com/apps/publish?account=6499663341265583899#ReviewDetailsPlace:p=com.flyrobe.android&reviewid=gp:AOqpTOHlDtXmAiDnxCyu23PcqSftxjJI0a2Od4PpNM-yaC7v9C77I1l6lRES2NuAZhMmIGg3zvcOcePDjAvrNg
com.flyrobe.android	35	2.2.4	en	fortuna3g	2017-03-07T11:59:29Z	1488887969424	2017-03-07T11:59:35Z	1488887975569	5		Makes it an ideal application to used for in terms of all the offerings you could definitely go to the utility				https://play.google.com/apps/publish?account=6499663341265583899#ReviewDetailsPlace:p=com.flyrobe.android&reviewid=gp:AOqpTOGwvGS1_mGlYIv5up1Cwi-_9WBexDgC1QC-4Cm2PndEmzFgIrNY85t8ZFqaJvXl2cvAZ1hh-liQdgXcLg
com.flyrobe.android	35	2.2.4	en	j7elte	2017-03-07T12:06:14Z	1488888374032	2017-03-07T12:06:23Z	1488888383947	5		fashion apartment app they've adorable have designs that is simply awesome perfect for girls purchasing online				https://play.google.com/apps/publish?account=6499663341265583899#ReviewDetailsPlace:p=com.flyrobe.android&reviewid=gp:AOqpTOGxGHBxm1cokUeaP8l9JtTPqhkeOJsPhhB8nf385GjU9sk_2nokpy5kc_NbIIJm0etMIMCRddV5naykLw
com.flyrobe.android	35	2.2.4	en	A1000	2017-03-07T12:07:07Z	1488888427434	2017-03-07T12:07:14Z	1488888434437	5		Very consumer pleasant and first-class to apply they have got loads of merchandise to be had here				https://play.google.com/apps/publish?account=6499663341265583899#ReviewDetailsPlace:p=com.flyrobe.android&reviewid=gp:AOqpTOGIeDOyyuUzGePtqG3JaeWUeQLIJEQOz0vwvSW-QyFQvu0mMzUoCUDRhFZcGSDJG8IelTquq0kfyWsmoQ
com.flyrobe.android	35	2.2.4	en	Eluga_A2	2017-03-07T12:19:26Z	1488889166430	2017-03-07T12:19:35Z	1488889175335	5		the perfect varierty of get in touch with lenses colors are in this particular report.				https://play.google.com/apps/publish?account=6499663341265583899#ReviewDetailsPlace:p=com.flyrobe.android&reviewid=gp:AOqpTOEW2HIQkLMvPbiHRumxjuNT3o9NoryUdYmYv_lKOKa-2ihkycWNLVO5u36e-zAxYobSTSDm2Et4jZNo_Q
com.flyrobe.android			en	A6020a46	2017-03-07T12:24:11Z	1488889451099	2017-03-07T12:24:16Z	1488889456860	5		Never seen an app like this before in my existence.Always love it using.				https://play.google.com/apps/publish?account=6499663341265583899#ReviewDetailsPlace:p=com.flyrobe.android&reviewid=gp:AOqpTOEXxBGZcJkckrRe3P0Wlc6efHaGq4NAXE8K6t_4ERT4lmK5gzrEYujwgUPq4vO0Q2QWN9XJMGR1EqqbhA
com.flyrobe.android			en	XT1663	2017-03-07T16:18:16Z	1488903496802	2017-03-07T16:18:19Z	1488903499564	2						
com.flyrobe.android			en	j7elte	2017-03-07T17:56:49Z	1488909409651	2017-03-07T17:57:17Z	1488909437276	5		I dont no				https://play.google.com/apps/publish?account=6499663341265583899#ReviewDetailsPlace:p=com.flyrobe.android&reviewid=gp:AOqpTOGXqZNHCGHgvDteUrHIpJtCYFDTZMxi5PKl9PL2x7X3bn3tXa5sf7wmVzOFnw6z5vOjv3qrHfrc1d6aew
com.flyrobe.android	35	2.2.4	en	YUPHORIA	2017-03-08T06:33:57Z	1488954837978	2017-03-08T06:34:06Z	1488954846261	5		excellent utility they have presenting an entire lot of customer offerings for people who want to buy garments written totally cross for this software				https://play.google.com/apps/publish?account=6499663341265583899#ReviewDetailsPlace:p=com.flyrobe.android&reviewid=gp:AOqpTOHlBjItSMOOxeDcYDGhdtPeMHWqsrA6nuy-8RYt8ynO9USLtat4rOfbUWPYUCwsrAGxXjlq5L9_l3yTfQ
com.flyrobe.android	35	2.2.4	en	j5lte	2017-03-08T06:38:37Z	1488955117481	2017-03-08T06:38:52Z	1488955132730	5		Amazingly desirable software and offerings also are virtually good i like to apply utility for the condominium services they offer				https://play.google.com/apps/publish?account=6499663341265583899#ReviewDetailsPlace:p=com.flyrobe.android&reviewid=gp:AOqpTOEUk2I2IlWc9jNvPYVXRUHIK2AmIzL__d8z0ikdmofFxwbYJMccVnRDi0gFqwCKA6zvRNa2puGqQ3AeUg
com.flyrobe.android	35	2.2.4	en	LS-5017	2017-03-08T06:39:33Z	1488955173213	2017-03-08T06:39:50Z	1488955190451	5		one of the numerous packages with a in reality exact at supplying the services they offer you treat rental garments for guys purchasing online				https://play.google.com/apps/publish?account=6499663341265583899#ReviewDetailsPlace:p=com.flyrobe.android&reviewid=gp:AOqpTOEKPT6al8mTK7bJqFq0d6DQH8dAsg8lEf1ATP6hoypH56BL0ByBqMQfvLVGeqLlOLPnRRw81AQNoR0NnQ
com.flyrobe.android	35	2.2.4	en	athene_f	2017-03-08T06:42:21Z	1488955341098	2017-03-08T06:42:26Z	1488955346937	5		Serial application for all the folks who like to shop for garments however also wish to store lots of cash you can they pass for this application has the entirety in a				https://play.google.com/apps/publish?account=6499663341265583899#ReviewDetailsPlace:p=com.flyrobe.android&reviewid=gp:AOqpTOG5vtpU-Gk9s1CckSjyCgardR5c4BrgvoUiSnAMUF1UTr_FoRF2NTHUw4NprMYkGJzuxNqj75ZrUwNJrQ
com.flyrobe.android	35	2.2.4	en	j7elte	2017-03-08T06:40:24Z	1488955224844	2017-03-08T06:46:07Z	1488955567093	5		The apartment services are truly desirable i am glad that I promise utility so without problems it's far truly exquisite to use this one				https://play.google.com/apps/publish?account=6499663341265583899#ReviewDetailsPlace:p=com.flyrobe.android&reviewid=gp:AOqpTOHtyT62ajCS6IsZQna8a18-NSAfKwgTKE4p68cL8IanmAZzoK2o3358P0m4-NW6Z9Peb2Z_di1adDBfDQ
com.flyrobe.android	35	2.2.4	en	athene_f	2017-03-08T06:51:28Z	1488955888471	2017-03-08T06:51:33Z	1488955893079	5		the offerings has helped me to store a variety of money this utility is in reality amazing in terms of offering you all the properly service				https://play.google.com/apps/publish?account=6499663341265583899#ReviewDetailsPlace:p=com.flyrobe.android&reviewid=gp:AOqpTOG0Xqw7uIZ945Hpf-uhNFoam8j6VWz-TnCFMsj1uTdDGJG8y-28UqzPTv7f2d9NPJmOd53qQ8luZSpsOA
com.flyrobe.android	35	2.2.4	en	X2-AP	2017-03-08T07:09:11Z	1488956951550	2017-03-08T07:09:22Z	1488956962308	5		hunter is a higher in each issue rather than shopping for garments lets you shop a variety of cash				https://play.google.com/apps/publish?account=6499663341265583899#ReviewDetailsPlace:p=com.flyrobe.android&reviewid=gp:AOqpTOFlrcDCPg7koeNgCdOb8aH3FLVDAFeRBKL-i48kQ-FZoHe2jmkIoSzVK4HfrjHpsF32Ijmhdiu8j-9CxQ
com.flyrobe.android	35	2.2.4	en	a5xelte	2017-03-08T07:10:05Z	1488957005264	2017-03-08T07:10:14Z	1488957014672	5		Very cool application they're presenting mode of services however can't find everywhere utility to pick using utility time and again for renting clothes on line				https://play.google.com/apps/publish?account=6499663341265583899#ReviewDetailsPlace:p=com.flyrobe.android&reviewid=gp:AOqpTOFTwpbOrWMNU1hUhtVFcTCrInV_J8hh2Bbr_wmi8gBgxjSFrvdhRZwfen9Tcx4GYJu0IGHOecSP3U2MLQ
com.flyrobe.android	35	2.2.4	en	1603	2017-03-08T07:09:52Z	1488956992943	2017-03-08T07:10:52Z	1488957052281	5		fitness fight first rate I absolutely love to apply this utility time and again one of the very first-rate applications ever found				https://play.google.com/apps/publish?account=6499663341265583899#ReviewDetailsPlace:p=com.flyrobe.android&reviewid=gp:AOqpTOGr1dXA0oS4IdCvTA6qJVjja2re--3Rv4ExR7LkKWjHvKyVfXXQ1BDvVjaQlhQb4i4Rw_7uzEFKbIw3qA
com.flyrobe.android	35	2.2.4	en	K50a40	2017-03-08T07:12:40Z	1488957160473	2017-03-08T07:12:48Z	1488957168826	5		notable easy uses of a totally love to use it they may be offering a lot of extraordinary services firm is software I definitely love tea uses utility for all of the services they provide condominium clothes and cut price also truely wonderful right here				https://play.google.com/apps/publish?account=6499663341265583899#ReviewDetailsPlace:p=com.flyrobe.android&reviewid=gp:AOqpTOGGmg_ghu2AN2COLZ2n1N-PDaft8YmJiup6_tbuQ1WKeACYxo2HS4aInKslzZ8rM0YQmbtps4H7W5bB8w
com.flyrobe.android	35	2.2.4	en	hlte	2017-03-08T07:19:35Z	1488957575009	2017-03-08T07:20:10Z	1488957610425	5		extraordinary application the crew has installed lots of efforts to offer the satisfactory application the quality of the product and additionally virtually awesome I definitely love to use is application it's so lots fun				https://play.google.com/apps/publish?account=6499663341265583899#ReviewDetailsPlace:p=com.flyrobe.android&reviewid=gp:AOqpTOHKb6WkwrgOMOwBzgf8TW5kT0FjumJiD_u8IcX9sQ_FNJPeu4LIazJxGj1xGj2AtXtgqgAKvLJCB6DMxg
com.flyrobe.android			en	CP8298_I00	2017-03-08T07:27:53Z	1488958073996	2017-03-08T07:28:06Z	1488958086994	5		correct application in phrases of all of the services they are main a lot better than roposo like packages				https://play.google.com/apps/publish?account=6499663341265583899#ReviewDetailsPlace:p=com.flyrobe.android&reviewid=gp:AOqpTOHZAR4zjtuykCgEakszBw3YKC5bFndwZcO9-tCOswxT9oduENMasGbk_SnJrQYmGZWyqOxBqbJbFJWqpQ
com.flyrobe.android			en	Y51L	2017-03-08T07:33:31Z	1488958411197	2017-03-08T07:35:42Z	1488958542499	5		series I definitely love that i might certainly ask for buddies to additionally use				https://play.google.com/apps/publish?account=6499663341265583899#ReviewDetailsPlace:p=com.flyrobe.android&reviewid=gp:AOqpTOFBfUbM-Lr1MqPOg3x92DtRKt_MKnjYQcCFyFdHneV7Bs3Drlcil82wCWsy-FQymuxjrgh7fFj0m4we4w
com.flyrobe.android	35	2.2.4	en	LS-5017	2017-03-08T07:37:25Z	1488958645619	2017-03-08T07:37:30Z	1488958650011	5		Cool collection of clothes we've a extensive type of final offerings to provide which makes it without a doubt amazing and fun to apply				https://play.google.com/apps/publish?account=6499663341265583899#ReviewDetailsPlace:p=com.flyrobe.android&reviewid=gp:AOqpTOGpB_b4mQwQ66y23DDdHaXbH5tKqIgCZlbGTA34KIWKFI2rnN67ouiqRCf3thKi22Ojt0PnTtW5sVRGuA
com.flyrobe.android	35	2.2.4	en	era_X	2017-03-08T07:43:11Z	1488958991763	2017-03-08T07:43:22Z	1488959002374	5		Cool software cool functions i have been the usage of it for a protracted. Of time software is without a doubt top to apply				https://play.google.com/apps/publish?account=6499663341265583899#ReviewDetailsPlace:p=com.flyrobe.android&reviewid=gp:AOqpTOEHLp6BKE7mEYIs2REUdm5YlF0AcTJv41RDy3LpMx8ALEi65QcGjayJCKDhKYfpH5mmRLiUMNnI9-G4mw
com.flyrobe.android	35	2.2.4	en	HM2014818	2017-03-08T07:46:17Z	1488959177984	2017-03-08T07:46:38Z	1488959198497	5		i like you this application it's far genuinely better than manual application is my great application for on-line purchasing functions				https://play.google.com/apps/publish?account=6499663341265583899#ReviewDetailsPlace:p=com.flyrobe.android&reviewid=gp:AOqpTOFuk-zmwmv7_piGgpM0OzY14L-Tda9EVtuAVJJFmWGqoAQwPCcfXcLagB1hTqnoxMBIXuH0JTsWw8mT9A
com.flyrobe.android	35	2.2.4	en	GiONEE_WBL7511	2017-03-08T07:47:12Z	1488959232602	2017-03-08T07:47:19Z	1488959239815	5		software remarkable functions sixteen dad the use of this utility and so you might not go for anywhere software at all				https://play.google.com/apps/publish?account=6499663341265583899#ReviewDetailsPlace:p=com.flyrobe.android&reviewid=gp:AOqpTOGllOACD_vm1vXDAvGG_VKe2vY1HvS1vgGJx3PiJUGSr4Eq4HbQx3LZB9LjmRJDBzUbJ0ZLwF6TISRi8g
com.flyrobe.android	35	2.2.4	en	osprey_ud2	2017-03-08T07:52:03Z	1488959523659	2017-03-08T07:52:12Z	1488959532204	5		which you can not discover in lots of other packages to click woolen Pan utility to apply for condominium offerings				https://play.google.com/apps/publish?account=6499663341265583899#ReviewDetailsPlace:p=com.flyrobe.android&reviewid=gp:AOqpTOEVacqyplGN_pDl96rVEHFlizXQ0ovvaJA9jNRjy87Yy4DOz9SerrEMNb44OjvLc0-BSA5pIoW65mvcKQ
com.flyrobe.android	35	2.2.4	en	LS-5016	2017-03-08T07:58:33Z	1488959913947	2017-03-08T07:58:41Z	1488959921158	5		faculty application assets furnished I truly higher than many different application it is exquisite liquid in phrases of all the services to provide				https://play.google.com/apps/publish?account=6499663341265583899#ReviewDetailsPlace:p=com.flyrobe.android&reviewid=gp:AOqpTOEjSFLnIwSajmQIEU0Ge80Ei0llyGjuMGZqrcUZ5876qJXq7Q7TR7EMdxn1jFo75RE25sWtydRhPLcwNg
com.flyrobe.android	35	2.2.4	en	Q380	2017-03-08T08:02:19Z	1488960139627	2017-03-08T08:03:29Z	1488960209233	5		proper utility they've pretty a number of deals And discounts going on and tell lot of this software is good for all of the apartment offerings that you need				https://play.google.com/apps/publish?account=6499663341265583899#ReviewDetailsPlace:p=com.flyrobe.android&reviewid=gp:AOqpTOFDg0u9HYboMGlX-Pz3nYH5Ey3luJFIPKELjcE-JbPFRPyljzIbX_362Frr8MPp1aM6XnVHKrWUY7ozQw
com.flyrobe.android	35	2.2.4	en	Q382	2017-03-08T08:05:03Z	1488960303930	2017-03-08T08:05:16Z	1488960316213	5		application is quite splendid day provide you lots of offers And reductions on renting garments on-line you could be assured of getting				https://play.google.com/apps/publish?account=6499663341265583899#ReviewDetailsPlace:p=com.flyrobe.android&reviewid=gp:AOqpTOHd8t8UuVF2LZ-MHktA9GUJuDczzJpxXiScoKByaSa8fQpr3kttSKtZ2ofAvme-nZICU9OIhc10QAonNQ
com.flyrobe.android	35	2.2.4	en	A33	2017-03-08T08:05:41Z	1488960341107	2017-03-08T08:05:48Z	1488960348586	5		the nice application services sales line call of an appropriate destination for on line buying I absolutely love uses utility and this is very particular to				https://play.google.com/apps/publish?account=6499663341265583899#ReviewDetailsPlace:p=com.flyrobe.android&reviewid=gp:AOqpTOGymViSyNfdwb4AD6AGLNIEn6xFC2UHxugVTtl38nuKIKwpTICF_V4wu2FqFtcpPPjKSyHF6qAuvT3M5w
com.flyrobe.android	35	2.2.4	en	A106	2017-03-08T08:07:15Z	1488960435795	2017-03-08T08:07:22Z	1488960442424	5		destination for all on-line shopping reviews are clearly excellent in this utility I M surprised uses application for ladies purchasing time and again				https://play.google.com/apps/publish?account=6499663341265583899#ReviewDetailsPlace:p=com.flyrobe.android&reviewid=gp:AOqpTOF8bNYwhtq_lHKOra3ALGXWZHMeJNfdRHWsBTb3H36Lwk152IEy_d6sujlM2Q8H69WMrSM0ygKrh5ZDXQ
com.flyrobe.android	35	2.2.4	en	land	2017-03-08T08:07:29Z	1488960449943	2017-03-08T08:07:47Z	1488960467810	5		awesome utility in terms of all of the product first-class it is surely excellent they offer great hyperlink street services at a completely reasonably-priced condo prices simply move for this application				https://play.google.com/apps/publish?account=6499663341265583899#ReviewDetailsPlace:p=com.flyrobe.android&reviewid=gp:AOqpTOGls95emNnB-i1Blh0N6m7lh3Z2CPX4cEHbRgjBjNxepZjl0Nx6lW6HKIiO5oQiX31X0rf2P_zntdbxKg
com.flyrobe.android	35	2.2.4	en	taido_row	2017-03-08T08:05:37Z	1488960337162	2017-03-08T08:10:08Z	1488960608402	5		It offers outfits at affordable prices and it's very affordable app for me.i like it				https://play.google.com/apps/publish?account=6499663341265583899#ReviewDetailsPlace:p=com.flyrobe.android&reviewid=gp:AOqpTOGCdhA-zTvUhL-dSOvh2H20s0v3XOqjs0wG1K1kAZJpnZo3HVGycgasCvs5PPt50F4oiLKNvLygkQ8pWQ
com.flyrobe.android	35	2.2.4	en	V3	2017-03-08T08:18:14Z	1488961094032	2017-03-08T08:18:27Z	1488961107310	5		The rental offerings are truely cheap and you could get a extensive range of garments and add-ons at very reasonably-priced prices you absolutely go for gasoline application				https://play.google.com/apps/publish?account=6499663341265583899#ReviewDetailsPlace:p=com.flyrobe.android&reviewid=gp:AOqpTOFWGkflePFzZRuyN_Oz5HBxUS_VgOPYif1M-Q5EJ4YXieBbmiSytGql8bSWWBl18G-v_FTPltzbRW88rA
com.flyrobe.android	35	2.2.4	en	V502430	2017-03-08T08:23:55Z	1488961435324	2017-03-08T08:24:00Z	1488961440437	5		I completely like to uses application they have got lots of factors that I won't be without problems available right here genuinely amusing and clean to use				https://play.google.com/apps/publish?account=6499663341265583899#ReviewDetailsPlace:p=com.flyrobe.android&reviewid=gp:AOqpTOG6bmk8ML6oOYamA6XqbBA4P43M8-qvcHsliprOPGNxDzFkiRh6flbKr9YjhEsfMmtmrQn8q6-jJlpckA
com.flyrobe.android			en	A6020a40	2017-03-08T08:36:33Z	1488962193643	2017-03-08T08:36:45Z	1488962205424	5						
com.flyrobe.android	35	2.2.4	en	Aqua_4G_Strong	2017-03-08T08:54:16Z	1488963256074	2017-03-08T08:54:16Z	1488963256074	5	use full	I do not experience the need to buy near Ones I started out using this software this became completely great i'm absolutely happy with the offerings they're presenting				https://play.google.com/apps/publish?account=6499663341265583899#ReviewDetailsPlace:p=com.flyrobe.android&reviewid=gp:AOqpTOGNPdQb_fj11j_44mP4TX0_O0tqRCryf6dXOkTTKg5pbDuhRad4MQ6Pmnu4P4BicV4QEgwRlSiJD97y5A
com.flyrobe.android	35	2.2.4	en	A7020a48	2017-03-08T09:12:13Z	1488964333008	2017-03-08T09:12:35Z	1488964355303	5		Cool application pool services they are truely proper at what they do that is what i like about this application				https://play.google.com/apps/publish?account=6499663341265583899#ReviewDetailsPlace:p=com.flyrobe.android&reviewid=gp:AOqpTOFFtNlyx7XG-9PQNd4CDCdTWFy27rd0VGQNkqNzbyJHjlhbWW19_vB5UwjwDHFLC5J8yj2En7Vxu2WisA
com.flyrobe.android	35	2.2.4	en	j2lte	2017-03-08T09:10:04Z	1488964204559	2017-03-08T09:13:56Z	1488964436182	5		Brothers application it is so a lot amusing and clean to apply any sort of stories for till shopping is to be had online so without difficulty				https://play.google.com/apps/publish?account=6499663341265583899#ReviewDetailsPlace:p=com.flyrobe.android&reviewid=gp:AOqpTOGBSMrXiVjRl33D3YR2oPREqrrVl736-WaiEEmLKnMyZLMfvntG3ZhxWRAFIxzsLlG-9qtG3wmAvJE09g
com.flyrobe.android	35	2.2.4	en	Q350	2017-03-08T09:18:28Z	1488964708547	2017-03-08T09:20:44Z	1488964844170	5		satisfied that i found this software I commonly use a number of cash whilst shopping for so many garments from this application flyrobe allows me to rent garments on line so easily				https://play.google.com/apps/publish?account=6499663341265583899#ReviewDetailsPlace:p=com.flyrobe.android&reviewid=gp:AOqpTOHPYHb9GlRpb0WQBYtet2e1JdRiyLe7Sddf24ItI8f_NtjbSJiWl3P9QiPnTzd7WYgnX9m_b7pGLHAD2Q
com.flyrobe.android	35	2.2.4	en	Kraft-A6000	2017-03-08T09:20:50Z	1488964850697	2017-03-08T09:20:55Z	1488964855951	5		Grid software with high-quality updates they're really graded providing the customer service which you want amazingly easy and easy to use				https://play.google.com/apps/publish?account=6499663341265583899#ReviewDetailsPlace:p=com.flyrobe.android&reviewid=gp:AOqpTOGwD0TQ1TF6hNb-9asCCnL7oV7ZRGfhWlZfFuYKnW2SOJ5IAwIizcrfS5TxSIhd8a9mqVC722lgcfmxUQ
com.flyrobe.android	35	2.2.4	en	LS-4008	2017-03-08T09:21:21Z	1488964881348	2017-03-08T09:22:32Z	1488964952407	5		Date application of IT services one of the very best packages in supplying so many excellent clothes on line so without difficulty thanks a lot for this software				https://play.google.com/apps/publish?account=6499663341265583899#ReviewDetailsPlace:p=com.flyrobe.android&reviewid=gp:AOqpTOEmxkaM4fKLriBLM9C4RagTd6i7tW1kJqQb4v-aiEn0AOgt3lpfe4nuM_JKQ2qJ9r028LkRxfD-062Jjg
com.flyrobe.android	35	2.2.4	en	ferrari	2017-03-08T09:23:14Z	1488964994539	2017-03-08T09:23:24Z	1488965004434	5		Make that amazingly simple to use any type of clothes are to be had on the daily fashion where is available so without difficulty the big apple				https://play.google.com/apps/publish?account=6499663341265583899#ReviewDetailsPlace:p=com.flyrobe.android&reviewid=gp:AOqpTOEcyaL2kra9NLsG1PVAzEqnAO0rhSnaFmiuo8MtgoRREZ1YXsyktQEtbXB_3KBNKq2lwdhw1faQ-krFZw
com.flyrobe.android			en	MACHONE	2017-03-08T09:28:11Z	1488965291824	2017-03-08T09:28:21Z	1488965301027	5		Makes it so amazing to get all the rental clothes online so easily found it really good in terms of getting on the clothes that is awesome				https://play.google.com/apps/publish?account=6499663341265583899#ReviewDetailsPlace:p=com.flyrobe.android&reviewid=gp:AOqpTOFIoWjxBBWGBmvyKPdrZ0UT2iI-B9zUI0FFaDTpZpWG10B4VBiK8b3henby7SlVgLDO8ew9a1PLZfDu8Q
com.flyrobe.android	35	2.2.4	en	GiONEE_WBW5612	2017-03-08T09:28:27Z	1488965307541	2017-03-08T09:31:34Z	1488965494992	5		Printer services of so much higher and less expensive than guide utility i found that without a doubt time saving and money saving assist me to save a number of efforts to that is really splendid for online looking for men buying in France visa lehigh				https://play.google.com/apps/publish?account=6499663341265583899#ReviewDetailsPlace:p=com.flyrobe.android&reviewid=gp:AOqpTOHQcFvORGYGWOvrCc3D3FYthLisK_Q1AvdhHtHo_wLjsR5fP98N1rh2oXejP4NumLFR_soKwezPSe8nbg
com.flyrobe.android	35	2.2.4	en	K50a40	2017-03-08T09:34:23Z	1488965663153	2017-03-08T09:34:32Z	1488965672792	5		close to be had for hire so easily Airtel a totally handy utility for all those those who like to save regularly				https://play.google.com/apps/publish?account=6499663341265583899#ReviewDetailsPlace:p=com.flyrobe.android&reviewid=gp:AOqpTOEHYlUNsYpR2vLRuDiQreHUIXcdvoZRtb9Y0PyQ6JXYFEUmzWY2CZ2AgAKEMHgdUnzI3dHZi2n_-LBFQw
com.flyrobe.android	35	2.2.4	en	j7elte	2017-03-08T09:35:58Z	1488965758851	2017-03-08T09:36:04Z	1488965764670	5		painting is a incredible idea I by no means notion i might use run to close but this turned into an software that modified my point of view completely high-quality application				https://play.google.com/apps/publish?account=6499663341265583899#ReviewDetailsPlace:p=com.flyrobe.android&reviewid=gp:AOqpTOEm4c5LSK9jsZNBszZN7rop8VDU8N6k32YlwQ_M8GU_ZCIRESQJzunXzHx6zUiKrhwCqHkIP3NkoQLuWA
com.flyrobe.android	35	2.2.4	en	land	2017-03-08T09:36:16Z	1488965776395	2017-03-08T09:36:22Z	1488965782785	5		Amazingly a very good place to search for luxury brands gives a variety of clothes that you cannot discover on many different applications like Myntra				https://play.google.com/apps/publish?account=6499663341265583899#ReviewDetailsPlace:p=com.flyrobe.android&reviewid=gp:AOqpTOFHzDj57fLPfd7LRTO7_QTToVWfZwOjMsjA6SJUCjmSSk-kCdk-9X_mIqRyg3nkvk9xqrjs_cQfndAJag
