com.flyrobe.android	35	2.2.4	en	CP3503I	2017-03-24T06:34:34Z	1490337274282	2017-03-24T06:35:08Z	1490337308071	5		am very much satisfied with flyrobe because it has many amazing features in it like women shopping and so on guys give it a try i am sure you will also like it .				https://play.google.com/apps/publish?account=6499663341265583899#ReviewDetailsPlace:p=com.flyrobe.android&reviewid=gp:AOqpTOFSo3Of8EdmW2FM_wb64ZJSX5FBSIR8gpH8CheLdgNNnAgVLr2hQrptID0xE79Smcfgcq_zm3_Pt9tngg
com.flyrobe.android			en	CPY83_I00	2017-03-24T06:45:50Z	1490337950820	2017-03-24T06:45:57Z	1490337957417	5		Now not only it permits you to lease dresses at a smaller fee however additionally allows you with special gives . What else would you want from any ladies shopping website online?				https://play.google.com/apps/publish?account=6499663341265583899#ReviewDetailsPlace:p=com.flyrobe.android&reviewid=gp:AOqpTOFeHf9vctm6t-cyjCnz5KPf0E5_Rwe1XYH9Xv2l6RHw7AlvyJMCmfke6eXRZGmnmNfNFqux6vkAMLfwpw
com.flyrobe.android			en	X3_HK	2017-03-24T06:55:06Z	1490338506558	2017-03-24T06:55:31Z	1490338531046	5		So far my experience is flyrobe is simply terrific and awesome they do give a reasonble price for such an amazing clothes which i am very happy with .				https://play.google.com/apps/publish?account=6499663341265583899#ReviewDetailsPlace:p=com.flyrobe.android&reviewid=gp:AOqpTOGbEThCUs2Djap4ZHWvBsgJqbSdds35pcZulVBJvFDd4BWNMYOm7yf9JUm2pp038kFFJ-I5WkMSfnhmIQ
com.flyrobe.android	35	2.2.4	en	P7	2017-03-24T06:56:34Z	1490338594464	2017-03-24T06:56:43Z	1490338603521	5		ONly and only great and nicer words for flyrobe because i can easily rent any styles of clothes i want at the palm of my hand which is the biggest feature of this amazing app which i like it a lot .				https://play.google.com/apps/publish?account=6499663341265583899#ReviewDetailsPlace:p=com.flyrobe.android&reviewid=gp:AOqpTOEu0LosH_0WTzwXICUcSQayV__fmYaZIttULU6_qTMLIrrQEfxboAE3j-1pRB4XrrE4Jb79JwkejZQgBQ
com.flyrobe.android	35	2.2.4	en	CP8298_I00	2017-03-24T07:00:01Z	1490338801540	2017-03-24T07:00:08Z	1490338808108	5		Oh my god i have never saw such an amazing varieties of clothes in my entire life flyrobe is truly an amazing shopping experience especially for women shopping .				https://play.google.com/apps/publish?account=6499663341265583899#ReviewDetailsPlace:p=com.flyrobe.android&reviewid=gp:AOqpTOFBAE1cBDf5neh8OZfFUgbsRKpP5XEKVlQ9-v-aKDYlX7NNO2DBhvsLDbk4yWLudlbIdw6TxRy2l1yw6g
com.flyrobe.android	35	2.2.4	en	Q383	2017-03-24T07:00:25Z	1490338825434	2017-03-24T07:00:52Z	1490338852197	5		So far very positive words to say for flyrobe because of this amazing app the women shopping experience has never been this great and i am grateful for this app .				https://play.google.com/apps/publish?account=6499663341265583899#ReviewDetailsPlace:p=com.flyrobe.android&reviewid=gp:AOqpTOG0MbD99DSovtPr5mnXO54y_MbdGP2W7E3rR22CRMmeWCDaTl27wRU7nSZzAMB5IKG9lgXG5wW2QTGDlw
com.flyrobe.android	35	2.2.4	en	Q465	2017-03-24T07:14:29Z	1490339669741	2017-03-24T07:14:46Z	1490339686530	5		I have never been this happy all thanks to flyrobe which has fulfilled my dream of awesome collections of clothes which has been quite great and awesome for me .				https://play.google.com/apps/publish?account=6499663341265583899#ReviewDetailsPlace:p=com.flyrobe.android&reviewid=gp:AOqpTOElYSWNeaN8r_RE7HJo0YZsZNa6UOoYQefYi1mHQV_HtKbzRYQ6tk5hOqW1em-T-zzx7_RSjy9PzI9bHw
com.flyrobe.android	35	2.2.4	en	T45_4G	2017-03-24T07:38:52Z	1490341132374	2017-03-24T07:39:08Z	1490341148133	5		People we need to give them the appreciation which we should have given flyrobe truly has an amazing women shopping experience which i am sure a lot of you must have noticed .				https://play.google.com/apps/publish?account=6499663341265583899#ReviewDetailsPlace:p=com.flyrobe.android&reviewid=gp:AOqpTOGfLCtJuQUmW0rM-pJakWULmdqZSZaWg1ix7h3kSoQIG8gMTUpqLPacpq3c6PyyyqgpbNj_9BsAGpVK8g
com.flyrobe.android	35	2.2.4	en	o5prolte	2017-03-24T07:41:59Z	1490341319276	2017-03-24T07:42:08Z	1490341328015	5		Verily i am happy with flyrobe so far they did such an amazing job with the shopping experience for which i am very grateful !				https://play.google.com/apps/publish?account=6499663341265583899#ReviewDetailsPlace:p=com.flyrobe.android&reviewid=gp:AOqpTOEXz9QZqfBtXqXWn2l9aqcU9vJ_93AUhN1tst9Zovqirx0_05LpcV44t_s9EOy05uPZNihkS7EQU3Pk9Q
com.flyrobe.android	35	2.2.4	en	Y51L	2017-03-24T08:00:35Z	1490342435249	2017-03-24T08:00:43Z	1490342443605	5		Only and only positive words for me to say so far for this amazing app with flyrobe i have been saving quite a lot of money with such amazing deals .				https://play.google.com/apps/publish?account=6499663341265583899#ReviewDetailsPlace:p=com.flyrobe.android&reviewid=gp:AOqpTOHbjIMIVWuQztSz4s1b4pfpsPGz4LytsT7nODta_00yhPLEGMmebClBblCoJmlpS3Om7eqManVHVW6LpA
com.flyrobe.android			en	athene_f	2017-03-24T08:08:17Z	1490342897513	2017-03-24T08:08:17Z	1490342897513	5						
com.flyrobe.android	35	2.2.4	en	on7xelte	2017-03-24T08:10:42Z	1490343042880	2017-03-24T08:11:02Z	1490343062855	5		Everything has been going great for me using this amazing app flyrobe i have made lots of varieties of clothes collection its simply the best women shopping app out there ever !				https://play.google.com/apps/publish?account=6499663341265583899#ReviewDetailsPlace:p=com.flyrobe.android&reviewid=gp:AOqpTOFszRcqW1mtq1Mgk_D6pFwNg24pXmzH2XXmuFAqrZZbVBv47_wE3nAp8VGSEkXQltuAMj7Wpjw6KlwO_g
com.flyrobe.android	35	2.2.4	en	j5lte	2017-03-24T08:19:30Z	1490343570769	2017-03-24T08:20:49Z	1490343649941	5		People usually don't know about the awesomeness of this app where we can easily rent clothes of any style which we would prefer which is quite amazing .				https://play.google.com/apps/publish?account=6499663341265583899#ReviewDetailsPlace:p=com.flyrobe.android&reviewid=gp:AOqpTOHD7YkvrIG3IkmH78XekEAfoOp2Y7qs6dd_qkKo-IX26iBp9mlMr8VP2tgGBJMVHZd1yLv2ulBlKMkMpA
com.flyrobe.android	35	2.2.4	en	j7elte	2017-03-24T08:23:48Z	1490343828298	2017-03-24T08:24:23Z	1490343863565	5		So far i am quite satisfied with flyrobe because it has many amazing features like women shopping also here we can rent clothes which is another plus point about this app .				https://play.google.com/apps/publish?account=6499663341265583899#ReviewDetailsPlace:p=com.flyrobe.android&reviewid=gp:AOqpTOFZ5_FDDLkGWRf7m5v0xSzx8KMdSGojNiwipV4mQCF9qJ8wTK9EKtQ8QIeqx12cbqmt5FYKNQxYV7f56w
com.flyrobe.android	35	2.2.4	en	A7010a48	2017-03-24T08:40:07Z	1490344807648	2017-03-24T08:40:44Z	1490344844311	5		Verily i mustt say using flyrobe has been quite an great experience for me so far and i am glad that i installed this app quite happy with it so far .				https://play.google.com/apps/publish?account=6499663341265583899#ReviewDetailsPlace:p=com.flyrobe.android&reviewid=gp:AOqpTOEOQHDcIeBIh-Dyo14nKY-kjl8dZY-FidBm7095N3HOzkAV3sRPkqFROCbNuQYU-7eVMllvfC0WtzV9aw
com.flyrobe.android	35	2.2.4	en	Q372	2017-03-24T08:44:31Z	1490345071101	2017-03-24T08:44:39Z	1490345079782	5		I have recommended flyrobe to all of my friends because it is such an amazing app it truly deserves a lot of our compliments i like this app a lot :D				https://play.google.com/apps/publish?account=6499663341265583899#ReviewDetailsPlace:p=com.flyrobe.android&reviewid=gp:AOqpTOHImIYgKTQXKXZHWpdcXW5zz8ceGdzw6I1Sek09GiyOUZcfGQecbYmaCnZdYzc5ggomUXDO1Qi6TD0BiQ
com.flyrobe.android	35	2.2.4	en	sp7731c_1h10_32v4_bird	2017-03-24T08:51:20Z	1490345480576	2017-03-24T08:51:25Z	1490345485653	5		flyrobe is simply the best women shopping app so far it has many varities of awesome sarees and dresses to look out for guys give it a try .				https://play.google.com/apps/publish?account=6499663341265583899#ReviewDetailsPlace:p=com.flyrobe.android&reviewid=gp:AOqpTOErpB9Xs_s2XWJeI4OOuffHjy-I-4ARNk4tkdrs0kwHQfOiinj02gUiWDZxZJ4dYd8-Yj_Q5jengIjV1w
com.flyrobe.android	35	2.2.4	en	A7010a48	2017-03-24T08:58:13Z	1490345893603	2017-03-24T08:59:58Z	1490345998149	5		flyrobe has made my women shopping life much easier and fun i am grateful for such an amazing app where i can easily do women shoppin as much as i want !				https://play.google.com/apps/publish?account=6499663341265583899#ReviewDetailsPlace:p=com.flyrobe.android&reviewid=gp:AOqpTOFGhZQN_YUBvzHmZDhDy2Um_QSJi1r2vSZ0Y_2LfsPWJbgnXncHg3dbVkKhJ9RdQnU4mhVQD_hp5n9lBg
com.flyrobe.android	35	2.2.4	en	X3_HK	2017-03-24T09:31:08Z	1490347868982	2017-03-24T09:31:13Z	1490347873828	5		Only and only positive and good experience to share so far for flyrobe because it has amazing feature of renting clothes online also the prices is quite reasonable !				https://play.google.com/apps/publish?account=6499663341265583899#ReviewDetailsPlace:p=com.flyrobe.android&reviewid=gp:AOqpTOHcB5nZjYR2IIp5zpEhR8gFt8UBTcWJJtUDwDr_kWomUh_PWFRVYlfZ0y1f4eT9rUsBOi7m9HXd9LlABQ
com.flyrobe.android	35	2.2.4	en	YUREKA	2017-03-24T09:34:54Z	1490348094796	2017-03-24T09:35:05Z	1490348105741	5		Only and only positive words to say so far for this amazing app flyrobe has made my women shopping experience quite great for which i am very helpful .				https://play.google.com/apps/publish?account=6499663341265583899#ReviewDetailsPlace:p=com.flyrobe.android&reviewid=gp:AOqpTOFMcf2OGK1b-lnF3YEqk-GIJXITdpHSCkmRHgn9MnqLXXJvYJ8AMMPpE2rVyZXnmiO_8pfCmZB6bFy2Tw
com.flyrobe.android	35	2.2.4	en	land	2017-03-24T09:48:29Z	1490348909799	2017-03-24T09:48:41Z	1490348921229	5		the discount coupons provided in flyrobe has been of great help for me as a women shopping for the best this app did help me a lot .				https://play.google.com/apps/publish?account=6499663341265583899#ReviewDetailsPlace:p=com.flyrobe.android&reviewid=gp:AOqpTOHp8xldE4m6cgjlg6IK2OHsYJoCH6oGi8AmPMwMJ54Xn3Y-saCIP4jsoSUdxbVLB8CQCIpPF9dkwtQVQA
com.flyrobe.android	35	2.2.4	en	GiONEE_WBW5615	2017-03-24T09:49:43Z	1490348983984	2017-03-24T09:49:54Z	1490348994885	5		Only positive and great words to say for such an amazing app flyrobe it has been making women shopping experience quite great and awesome for me for which i am grateful .				https://play.google.com/apps/publish?account=6499663341265583899#ReviewDetailsPlace:p=com.flyrobe.android&reviewid=gp:AOqpTOH3FWBsGVhdBmeHE5VZRd6YJQAOEqIEK3UwZ8aauZ12nevhouV_8iivk-68PtU_caHB7OZ0X3Cyxaftuw
com.flyrobe.android	35	2.2.4	en	j5lte	2017-03-24T10:14:48Z	1490350488230	2017-03-24T10:15:01Z	1490350501120	5		So far so great with flyrobe i have been very satisfied with it guys with this app i have been making quite a lot of money especially thanks to women shopping its going great .				https://play.google.com/apps/publish?account=6499663341265583899#ReviewDetailsPlace:p=com.flyrobe.android&reviewid=gp:AOqpTOFyOR1zjdiDWKjP2GwLKNlvb_dHcocydhAwQEmdns_BDdscZ-fJlTwJfI9bxQckB8jyD_p0do7juoe9Pw
com.flyrobe.android	35	2.2.4	en	A7010a48	2017-03-24T10:19:07Z	1490350747541	2017-03-24T10:19:31Z	1490350771156	5		flyrobe is truly appreciated of all the love and respect and appreciation for their amazing job i like this app a lot guys believe me .				https://play.google.com/apps/publish?account=6499663341265583899#ReviewDetailsPlace:p=com.flyrobe.android&reviewid=gp:AOqpTOEMjpy-3lMM0EqXPaQkNqCLhtBmWZxfdvHYmGW8PyeV8jBklBRDWvN4w6D5HqIDnKoyYpx_4VjJ_Zh-IA
com.flyrobe.android	35	2.2.4	en	j7elte	2017-03-24T10:28:57Z	1490351337078	2017-03-24T10:29:08Z	1490351348532	5		rent clothes on flyrobe is truly an amazing thing guys also it has many awesome indian and western styles to choose from which is another plus point about this app .				https://play.google.com/apps/publish?account=6499663341265583899#ReviewDetailsPlace:p=com.flyrobe.android&reviewid=gp:AOqpTOEyxpkt7yTjs6gfcVRMN9lHZ1-kt70-Pu0pecy8-_A4NODEJRrEHhE81LfxIpOIGxacQb3Ngcw731WAmw
com.flyrobe.android	35	2.2.4	en	A6020a40	2017-03-24T10:31:35Z	1490351495343	2017-03-24T10:31:54Z	1490351514235	5		very awesome app guys with flyrobe now i can easily rent awesome varieties of foreign as well as indian varieties which is quite awesome isn't it? also the prices is also great in here .				https://play.google.com/apps/publish?account=6499663341265583899#ReviewDetailsPlace:p=com.flyrobe.android&reviewid=gp:AOqpTOGi_yis3W--MnBYOqXLFGGmG_yTmNUhpHdnHSNJGeGQ8CTi-RrbKvOZ_X-PUd0BDHfVFNu9pMR4xIl2pg
com.flyrobe.android	35	2.2.4	en	Q469	2017-03-24T10:22:21Z	1490350941671	2017-03-24T10:32:12Z	1490351532107	5		Very good and useful app guys with flyrobe my life has never been this easier and better i am very much appreciating such an awesome app it deserves it !				https://play.google.com/apps/publish?account=6499663341265583899#ReviewDetailsPlace:p=com.flyrobe.android&reviewid=gp:AOqpTOECuSIUcrdOJRHP8i8UINGqD1X5P1w3y-XRJat9QlnQf2WMFJhBOPYtaVn9PR78ZQauQrzLvNyD5r78vA
com.flyrobe.android	35	2.2.4	en	Q4201	2017-03-24T10:40:41Z	1490352041362	2017-03-24T10:40:50Z	1490352050734	5		Very happy using flyrobe so far because of this amazing app now i can easily rent clothes that i want in many different styles which is another plus point about this app awesome ins't it?				https://play.google.com/apps/publish?account=6499663341265583899#ReviewDetailsPlace:p=com.flyrobe.android&reviewid=gp:AOqpTOFNP8KrbD-6XDOx30punmx6K8WvE7slvXZB2Ob0gfFSjFFgKu1j8HUQfKsAtp4yYO7oJKKcDYrN1N8k0g
com.flyrobe.android	35	2.2.4	en	on7xelte	2017-03-24T10:49:44Z	1490352584710	2017-03-24T10:49:49Z	1490352589247	5		Very much appreciated for such an amazing app guys with it now i can easily rent clothes which is quite great .				https://play.google.com/apps/publish?account=6499663341265583899#ReviewDetailsPlace:p=com.flyrobe.android&reviewid=gp:AOqpTOF8Sn5IG6Xc1zQGdbASJmkW7JRGt8Khyrt8t1WfAmenX9aa1L2fgmhakqnYFAAH5rNpuWSCkqmwjCbFJg
com.flyrobe.android	35	2.2.4	en	P1ma40	2017-03-24T11:01:21Z	1490353281292	2017-03-24T11:01:34Z	1490353294311	5		Very much happy with flyrobe so far and truly they deserve a lot of compliments so far very much appreciated for such an awesome and amazing app .				https://play.google.com/apps/publish?account=6499663341265583899#ReviewDetailsPlace:p=com.flyrobe.android&reviewid=gp:AOqpTOFHiG_Do5l3xGNL3fhXqIYx4wU85EzmH28nSckShhCBch0gTDRuqG19zUnpnilvjT7hawzuYM5x-R9vYQ
com.flyrobe.android	35	2.2.4	en	itel_it1508	2017-03-24T11:05:08Z	1490353508483	2017-03-24T11:05:14Z	1490353514067	5		Very much awesome app indeed i must say with flyrobe my shopping experience has never been this better all thanks to this amazing app which is doing the best for all of us .				https://play.google.com/apps/publish?account=6499663341265583899#ReviewDetailsPlace:p=com.flyrobe.android&reviewid=gp:AOqpTOEzlTZNV2RtFvl1tlBai7_TLKBBF0ln_Rh4I2mQQR43gVZ2xdQJ5wNZKBwur2guhfYRa0X5o0pJZJnbkg
com.flyrobe.android	35	2.2.4	en	cancro	2017-03-24T11:14:50Z	1490354090771	2017-03-24T11:14:57Z	1490354097304	5		Very much needed app guys if you are looking for an awesome experience of women shopping then look no further this app will do your purpose .				https://play.google.com/apps/publish?account=6499663341265583899#ReviewDetailsPlace:p=com.flyrobe.android&reviewid=gp:AOqpTOFOv63v1nxtiyKY4WsvX9v8ba9wx1_6wanMyT8jpeVpumYL9N7UymvINQcrjo3MOZ2TxOZK-CfcjAU2hA
com.flyrobe.android			en	LS-4503	2017-03-24T11:22:29Z	1490354549380	2017-03-24T11:22:35Z	1490354555424	5		I am not joking girls, it ias possible now, you can now rent the outfits what your favourite movie star wore. It all happens only due to flyrobes application. Thank you flyrobe.				https://play.google.com/apps/publish?account=6499663341265583899#ReviewDetailsPlace:p=com.flyrobe.android&reviewid=gp:AOqpTOHrSCqoSdu85ApIP5wny9KJ3RycoTpSBiEpbRPz3ljH4wrc0omlplgd0W75yh9Cgyv5wBxNGsJ0cp7UPQ
com.flyrobe.android	35	2.2.4	en	j2lte	2017-03-24T11:29:40Z	1490354980305	2017-03-24T11:29:49Z	1490354989323	5		Very satsified with flyrobe i must say because of this amazing app i can now rent clothes which is another plus point about this amazing app .				https://play.google.com/apps/publish?account=6499663341265583899#ReviewDetailsPlace:p=com.flyrobe.android&reviewid=gp:AOqpTOF-UIxeZf7QZ-f2Vnfx6J_sYB0X-PHNQkh0eXkp4hpbsWCp5V_ZxwWPu2llzkEZlYHVv3QmWlRYHQ2ISw
com.flyrobe.android	35	2.2.4	en	j2lte	2017-03-24T11:43:57Z	1490355837435	2017-03-24T11:44:07Z	1490355847272	5		We should be happy for such an awesome and amazing app guys flyrobe truly did the best when it comes to women shopping believe me guys i am happy with it so far :D				https://play.google.com/apps/publish?account=6499663341265583899#ReviewDetailsPlace:p=com.flyrobe.android&reviewid=gp:AOqpTOERiCnu81Z9lB50sFjUwfDAm1M9n252wFJwP5RNXLMhih-_4zP_Xi4un0rmdMzBH2sPO2AbLvEsG9zYLw
com.flyrobe.android	35	2.2.4	en	A6020a40	2017-03-24T11:44:36Z	1490355876398	2017-03-24T11:44:48Z	1490355888214	5		Big love and respect and appreciation for flyrobe because of which now i can do women shopping for such an amazing deals .				https://play.google.com/apps/publish?account=6499663341265583899#ReviewDetailsPlace:p=com.flyrobe.android&reviewid=gp:AOqpTOGU8d-5zgY451rvgE2Y1Y-SN7oXmS5YFNs9W_TI4_v6CyCdxqsMQiVHhUHCSqKYkxCPC-J5ilnZOFHCQQ
com.flyrobe.android	35	2.2.4	en	AQ5001	2017-03-24T11:49:07Z	1490356147962	2017-03-24T11:49:16Z	1490356156720	5		flyrobe has amazing discount coupons guys believe me the deals that they offer is also great i like this app a lot give it a try .				https://play.google.com/apps/publish?account=6499663341265583899#ReviewDetailsPlace:p=com.flyrobe.android&reviewid=gp:AOqpTOH1zSQMTRD0ZRVXi7MX9sr4K0e4otSntuREdreNILBDrmGjfSSQGUSXa-BhZXuYnjtSKzrEfe7SyqYRdQ
com.flyrobe.android			en	1201	2017-03-24T11:57:45Z	1490356665348	2017-03-24T11:57:50Z	1490356670875	5		The idea of rent clothes first afflicted me a bit but i did it any way seeing as there's no essential harm in it , their styler came to my house as i fixed my appointment with him he took my measurements and tailor-made the match flawlessly for my length				https://play.google.com/apps/publish?account=6499663341265583899#ReviewDetailsPlace:p=com.flyrobe.android&reviewid=gp:AOqpTOEsnk0OIIuCKVe2wQmkiu-zDhTvbFCdmPfPYOGpAv33QfD98tIZyVSq7kOPK-RTDvR-_TeptqLC1Ajkng
com.flyrobe.android	35	2.2.4	en	j2lte	2017-03-17T13:07:14Z	1489756034719	2017-03-24T12:12:10Z	1490357530745	5		i love voit app and i suppose this voot app is the high-quality of all. So, make way for developing the satisfactory pastime. In case you love these movies you then need to attempt voot				https://play.google.com/apps/publish?account=6499663341265583899#ReviewDetailsPlace:p=com.flyrobe.android&reviewid=gp:AOqpTOFd5HLfWUqbe3pjkMT_780TfSoYi5oSZb5-lmSGCWlWI1G-P-mGbImo_pJRZY9AELI3Rpr-svWVjdGPHw
com.flyrobe.android	35	2.2.4	en	Q380	2017-03-24T12:20:08Z	1490358008768	2017-03-24T12:20:08Z	1490358008768	5						
com.flyrobe.android	35	2.2.4	en	j5lte	2017-03-24T09:31:31Z	1490347891619	2017-03-24T12:39:45Z	1490359185104	5		flyrobe has such an amazing varieties of different styles of clothes to look out for and its awesome because with lots of varieties the women shopping experience is only going to get better .				https://play.google.com/apps/publish?account=6499663341265583899#ReviewDetailsPlace:p=com.flyrobe.android&reviewid=gp:AOqpTOFrPn1orSSvCRVK_vZWs4CiUxq0ttjeiwhkVHTRCUgkS7m8sN3Ho5TpcvEEehe4Ue3fS_4WjrGwddfEkg
com.flyrobe.android	35	2.2.4	en	HM2014818	2017-03-24T12:44:49Z	1490359489412	2017-03-24T12:44:56Z	1490359496735	5		flyrobe has to be one of the best when it comes to doing women shopping and it rightfully deserves the spot believe me guys .				https://play.google.com/apps/publish?account=6499663341265583899#ReviewDetailsPlace:p=com.flyrobe.android&reviewid=gp:AOqpTOFSQuHcAXXIZOqieT4OMmfqLDvhKEg21_PzgqBJvZ4cHRDSXoMxFUy0WKeZKdl47k144BYF2Td069KANA
com.flyrobe.android	35	2.2.4	en	land	2017-03-24T12:35:04Z	1490358904959	2017-03-24T12:48:35Z	1490359715413	5		flyrobe has many amazing varities of clothes for women shopping guys give it a try .				https://play.google.com/apps/publish?account=6499663341265583899#ReviewDetailsPlace:p=com.flyrobe.android&reviewid=gp:AOqpTOExKwwgI03qjzUgH2RTiBwrUg_3FhCzqWASm6lG5-QfiACo5-6wXqxT80GBS4ZWF7VabDaV-ajtUZiMBw
com.flyrobe.android	35	2.2.4	en	j2lte	2017-03-24T12:50:19Z	1490359819090	2017-03-24T12:58:46Z	1490360326482	5		flyrobe has to be the best women shopping app out there guys believe me this app truly deserves a lot of our appreciation and love i like this app a lot .				https://play.google.com/apps/publish?account=6499663341265583899#ReviewDetailsPlace:p=com.flyrobe.android&reviewid=gp:AOqpTOFKO9n1jmim-jNqSmQEkyPmWcLlyvi2joaTdYIF8ugLysLKF9dgV5Nf7hgJRog4QRMuRm8eP5HYrOrUug
com.flyrobe.android	35	2.2.4	en	kenzo	2017-03-24T13:26:54Z	1490362014393	2017-03-24T13:27:02Z	1490362022733	5		flyrobe has to be the best women shopping app till date and believe me its true to its name this app is simply amazing .				https://play.google.com/apps/publish?account=6499663341265583899#ReviewDetailsPlace:p=com.flyrobe.android&reviewid=gp:AOqpTOE8f81tIlR5EPQD-RqyJBj9rT7uCLDoiIntmYNSVfB03y7AME2KTEfRPP3h5qYhRUI5pSB4tK_qSA0D0g
com.flyrobe.android	35	2.2.4	en	K50a40	2017-03-24T13:39:52Z	1490362792831	2017-03-24T13:41:49Z	1490362909631	5		flyrobe must be the best women shopping app out there for a reason because i believe this app would for sure change our perspective of shopping online anywhere else in the app .				https://play.google.com/apps/publish?account=6499663341265583899#ReviewDetailsPlace:p=com.flyrobe.android&reviewid=gp:AOqpTOElCGu6JO5HLnfLnwHf-X-Q_95wF4GxHv_cQm8KQCOf5zxOedW5MRGZulphAESEpnqe9Bk7SxOLviqVVA
com.flyrobe.android	35	2.2.4	en	LS-4503	2017-03-24T13:50:34Z	1490363434952	2017-03-24T13:50:44Z	1490363444920	5		flyrobe must be the only women shopping app so far on the playstore because it has many great discount coupons wich i also liked about this app .				https://play.google.com/apps/publish?account=6499663341265583899#ReviewDetailsPlace:p=com.flyrobe.android&reviewid=gp:AOqpTOFA5kqJWgPPgsCAiHMdI9oRHUfHFFozkHzTiBI4qSPIac6aNSoge4t3cZU9HWUBGU8bsiJPUNKljkBLfA
com.flyrobe.android	35	2.2.4	en	o5prolte	2017-03-24T13:52:29Z	1490363549077	2017-03-24T13:52:40Z	1490363560620	5		flyrobe must have been the best women shopping app out there and there is many reasons for it just download it and you will know why this app is awesome .				https://play.google.com/apps/publish?account=6499663341265583899#ReviewDetailsPlace:p=com.flyrobe.android&reviewid=gp:AOqpTOGxrUT8SoDuERrRrJ3Ix5uUa1jq-DMI9cZlRQp4x63x5YnX-Bk5XacmgZ7Lx1Mg7L4tv3J7VAXcwU6g_g
com.flyrobe.android	35	2.2.4	en	gt58lte	2017-03-24T14:08:18Z	1490364498781	2017-03-24T14:08:27Z	1490364507837	5		GUys flyrobe truly deserve a lot of our appreciation because this app i believe is simply amazing !				https://play.google.com/apps/publish?account=6499663341265583899#ReviewDetailsPlace:p=com.flyrobe.android&reviewid=gp:AOqpTOGaclV_FRn3235r7xBRbWg559pj-zXqxGJtBVe3mCiLOifiZjAmk-Qpj1-B04N-5bhw5ilNM5FddmZ3bw
com.flyrobe.android	35	2.2.4	en	kenzo	2017-03-24T14:13:52Z	1490364832305	2017-03-24T14:13:58Z	1490364838200	5		One and only best app so far guys flyrobe has been making my shopping life better and better and truly this app do deserve a lot of our appreciation such a awesome app indeed i am very glad for this app .				https://play.google.com/apps/publish?account=6499663341265583899#ReviewDetailsPlace:p=com.flyrobe.android&reviewid=gp:AOqpTOFN5bGio4B28RFaETAEXzXnGZxjPe8CC9b2uV4AoLvIEVcFkLyn5EfXBHHKqZgEhUxotzC00FCoVPcjug
com.flyrobe.android	35	2.2.4	en	ASUS_Z010_CD	2017-03-24T14:20:09Z	1490365209587	2017-03-24T14:20:20Z	1490365220383	5		Only great and positive words to say so far for flyrobe because of its amazing rent clothes feature where we can look for the best dress we would ever want .				https://play.google.com/apps/publish?account=6499663341265583899#ReviewDetailsPlace:p=com.flyrobe.android&reviewid=gp:AOqpTOHE6nuCgGvMp1d1zHHaRCsdhJQYGnCAKZfgh0dJ9PlB9m25pRS9G4IkPoXYIeBixLvik7GRE9JSPqlbeA
com.flyrobe.android	35	2.2.4	en	A37f	2017-03-24T12:02:30Z	1490356950543	2017-03-24T14:21:23Z	1490365283212	5		flyrobe has been pretty awesome app for so far when it comes to wome shopping because of this app now i can easily shop lots of different varieties of women wearing i love it .				https://play.google.com/apps/publish?account=6499663341265583899#ReviewDetailsPlace:p=com.flyrobe.android&reviewid=gp:AOqpTOHWp28-NYcOqZd-LorXTU-t88t1ElHy8Ockbfmr-9ATsDdNFBMah9Lqw6fZIvQR7k-U04UK1bypPUEM9g
com.flyrobe.android	35	2.2.4	en	CP8298_I00	2017-03-24T14:23:41Z	1490365421340	2017-03-24T14:23:54Z	1490365434711	5		Only positive and great experience to share so far using flyrobe because it has made my experience as a women shopping better and better i am sure many of yur guys would also be feeling the same .				https://play.google.com/apps/publish?account=6499663341265583899#ReviewDetailsPlace:p=com.flyrobe.android&reviewid=gp:AOqpTOEV9oJ40xEefScjQyn4NXmqsKgyEzQrciMWLxn5HbOhYaO88vtJ_pVD5Uzg0-hFP8LYsZ9NEqerbBNm2Q
com.flyrobe.android	35	2.2.4	en	lava6735p_sp31_lte	2017-03-24T14:29:55Z	1490365795962	2017-03-24T14:30:07Z	1490365807753	5		So far flyrobe has amazing discount coupons so far also the renting feature of this app is also amazing guys give it a try its truly worth your time .				https://play.google.com/apps/publish?account=6499663341265583899#ReviewDetailsPlace:p=com.flyrobe.android&reviewid=gp:AOqpTOFXFF8P-w3TKHCxOHbdaOFFrO_hssZ0XjaLDEhqLI85ibC6t-Qeb3jvlRJvFOYAlK2RUJqdvqw-o542ng
com.flyrobe.android			en	land	2017-03-24T14:29:59Z	1490365799929	2017-03-24T14:30:27Z	1490365827126	5		Only positive words to sayso far for flyrobe because of this app now i no longer have to look for another great women shopping app as this app would surely do that purpose .				https://play.google.com/apps/publish?account=6499663341265583899#ReviewDetailsPlace:p=com.flyrobe.android&reviewid=gp:AOqpTOG4w4UU9UWNOWkoU-_KxkKKI2Yxr8R4iPT_Pp6L1Xs3UjxFJqrwdrRIXxVFn0x7NMQXxPCzlSXscVaToA
