com.flyrobe.android			en	ASUS_T00J	2016-11-14T08:59:40Z	1479113980763	2016-11-14T08:59:40Z	1479113980763	5		Now you can get to wear your dream lehenga just by renting and get it customized as per your fit for your day only in flyrobe . No other app will give you such kind of service . Truly great .				https://play.google.com/apps/publish?account=6499663341265583899#ReviewDetailsPlace:p=com.flyrobe.android&reviewid=gp:AOqpTOG_gEYcI32IDdcYtrkh0-Fv92GH9Dn640LVHrryTui4rv7E8DIf_PcRKGKzM9_d3z7Th7NkLt4oNym3rw
com.flyrobe.android	31	2.2.0	en	w158_wkt_251	2016-11-14T09:01:18Z	1479114078802	2016-11-14T09:01:18Z	1479114078802	5		Flyrobe is for crazy womens who love shopping but who end up with window shopping just because of it been expensive . You can rent dress now and get it for your day only in flyrobe .				https://play.google.com/apps/publish?account=6499663341265583899#ReviewDetailsPlace:p=com.flyrobe.android&reviewid=gp:AOqpTOEHebROTceCFJKIho6tqk2sUxmg48KgIz4_BSnjBMdrJXI6Js_tieCT0XNpVo56nwPTcKtgppjf0rVXLA
com.flyrobe.android			en	E313	2016-11-14T09:02:27Z	1479114147774	2016-11-14T09:02:27Z	1479114147774	5		Totally different concept from koovs and voonik ! You get the best quality and service from Flyrobe . Highly recommending this app .				https://play.google.com/apps/publish?account=6499663341265583899#ReviewDetailsPlace:p=com.flyrobe.android&reviewid=gp:AOqpTOEqC52t6myAgjYE8b5HhMXSVtrwvH2HRjoxQqbYNyLbCqT6AwSJxGjp-4yMbSXXxFoD419aPumrs-PDOQ
com.flyrobe.android	31	2.2.0	en	era_4G	2016-11-14T09:02:52Z	1479114172991	2016-11-14T09:02:52Z	1479114172991	5	Useful	I would highly recommend everyone to use flyrobe than any other app . You don't have to waste your money by buying clothes just for one day . Get rented for that particular day , from flyrobe . They provide you with great services . I am a regular customer of this ap .				https://play.google.com/apps/publish?account=6499663341265583899#ReviewDetailsPlace:p=com.flyrobe.android&reviewid=gp:AOqpTOGLGXDeHaOLUMmVHNx5h_DccfAixX0InV-IgPEfMjU6e1v_lMWYAcTSwN3b_x4CrwNAWCIlmbyMrRKBrw
com.flyrobe.android	31	2.2.0	en	jfltetmo	2016-11-14T09:05:57Z	1479114357671	2016-11-14T09:05:57Z	1479114357671	5		The rates are reasonable . Service is good . You will get the best quality product . Delivery on time . No payment and returning issues . No other app would give you such feel , but Flyrobe . Huge thanks to this ap .				https://play.google.com/apps/publish?account=6499663341265583899#ReviewDetailsPlace:p=com.flyrobe.android&reviewid=gp:AOqpTOE4ajBr9eGRgvOlLL9s9dAWMdZf6hkWF18rG0d-L-NlVq4drdyUfZl2WoXrdbLmcJ6vzgGgnmZ-Y5E2Nw
com.flyrobe.android	31	2.2.0	en	j2lte	2016-11-14T09:11:36Z	1479114696633	2016-11-14T09:11:36Z	1479114696633	5		I would recommend everyone to use flyrobe . It is far better than koovs or asos . I personally had a bad experience with koovs . Flyrobe gives you the best quality .				https://play.google.com/apps/publish?account=6499663341265583899#ReviewDetailsPlace:p=com.flyrobe.android&reviewid=gp:AOqpTOFd98mbFEyyiIamOuj2CO-vr_DsV1J1IPCuWmebNBubXQpZMgD1VPbJZxPBf-O3kGhgfsooFiLt_m4EGw
com.flyrobe.android	31	2.2.0	en	hammerhead	2016-11-14T09:12:33Z	1479114753149	2016-11-14T09:12:33Z	1479114753149	5		The services are very good from flyrobe . Very much impressed with all the services provided . From easy purchasing to quick delivery , everything is so good about this app				https://play.google.com/apps/publish?account=6499663341265583899#ReviewDetailsPlace:p=com.flyrobe.android&reviewid=gp:AOqpTOHQMpvltXG-sab6UPnIwPsaHGGi--oLCycr6woPkUpzbYDsN6AMVLu9uf6qqKm0rGugWtQqCk-KbNriTg
com.flyrobe.android	31	2.2.0	en	AQ5001	2016-11-14T09:15:31Z	1479114931768	2016-11-14T09:15:31Z	1479114931768	5		Though let it not be your occasion , being an event manager , present over that occasion should always be well presentable . So for such events I rent dress from flyrobe itself . My money and time is saved , because of this app .				https://play.google.com/apps/publish?account=6499663341265583899#ReviewDetailsPlace:p=com.flyrobe.android&reviewid=gp:AOqpTOHAbfNygL5j_0lRZ_ihCK2e3vi7nrAi3AzEV15gv1NFB2aCKDbihLn5XgWRHXXiJPzYGnAlg4XQYh-LyQ
com.flyrobe.android	31	2.2.0	en	acer_T02	2016-11-14T09:19:44Z	1479115184930	2016-11-14T09:19:44Z	1479115184930	5		Super amazing concept ! Worth of using this ! User and pocket friendly app . You get the amazing experience from flyrobe itself .				https://play.google.com/apps/publish?account=6499663341265583899#ReviewDetailsPlace:p=com.flyrobe.android&reviewid=gp:AOqpTOFkW235wBHm9iNCKFjEsmpNdv2h8EXXg0oXEvF5IJ69LiLFbUMtkDrCYDbQP2o1juaclRe_O4NoRPggpg
com.flyrobe.android			en	Kraft-A6000	2016-11-14T09:22:20Z	1479115340401	2016-11-14T09:22:20Z	1479115340401	5		wanted to wear something beautiful on the event of my husband's promotion party . . . . . . . thanks to this app that i found a really exceptional dress for myself . . . . best site for women shopping ! !				https://play.google.com/apps/publish?account=6499663341265583899#ReviewDetailsPlace:p=com.flyrobe.android&reviewid=gp:AOqpTOH84fNdO_Pq7bzNlEpqoD64BrQaEVG5lUsyWj3xCCsuAbpkY_Azk2o1h5j01DbhM-xS5w5mx5K8iVKFWA
com.flyrobe.android	31	2.2.0	en	m0	2016-11-14T09:27:10Z	1479115630018	2016-11-14T09:27:10Z	1479115630018	5		Flyrobe is one of the new great app and concept brought up all . It is amazing . You can rent clothes and get customized as per your fit . It's pocket friendly also . The app is also simple and easy to use .				https://play.google.com/apps/publish?account=6499663341265583899#ReviewDetailsPlace:p=com.flyrobe.android&reviewid=gp:AOqpTOEW-5M3Ns4wdrbt9GtaKoVUAwv8UHzJEbn7gn096lcYpHLZUK7c3NZWTqIame5dD8vXaBaXEkiTHefIEA
com.flyrobe.android	31	2.2.0	en	j3xlte	2016-11-14T09:23:24Z	1479115404890	2016-11-14T09:27:17Z	1479115637528	5		It was a good experience using flyrobe . I had to just click , wear , pay and return sitting at home itself . There was no issue with there any kind of services .				https://play.google.com/apps/publish?account=6499663341265583899#ReviewDetailsPlace:p=com.flyrobe.android&reviewid=gp:AOqpTOHKgeQMXpTWv1FlfG-q51YzDpheWA3Q4ptblZBwkSAmk_54xTx5bdjJnbEiCqsVE5upu27Rw6jiCQSJcQ
com.flyrobe.android	31	2.2.0	en	C1904	2016-11-14T09:29:28Z	1479115768615	2016-11-14T09:29:28Z	1479115768615	5		Flyrobe Fashion Shopping has got a cool section with information about latest styles and trends . Totally amazing collections , you will definetly love it .				https://play.google.com/apps/publish?account=6499663341265583899#ReviewDetailsPlace:p=com.flyrobe.android&reviewid=gp:AOqpTOEMOYlByQj1MkRzIkjxgPF_12CXl5PLl6Ubm0iLcG-oEHKRoHhZnY9cm476jgOyHtCVhEPN5yKU_lTzQg
com.flyrobe.android	31	2.2.0	en	fortuna3g	2016-11-14T09:34:06Z	1479116046990	2016-11-14T09:35:46Z	1479116146544	5		Flyrobe is totally easy and secure checkout app . You get the best quality and service by them . They rent you the best branded collections only . Totally worth to use .				https://play.google.com/apps/publish?account=6499663341265583899#ReviewDetailsPlace:p=com.flyrobe.android&reviewid=gp:AOqpTOEjPXS0qH6HmfDzbp5_s-7P_v1Ees-OOLwIHiaZNdGCU-R_gQ21Ro1WzMNrir_v9_Q8x2r0Q20FS4PNlw
com.flyrobe.android	31	2.2.0	en	LS-4505	2016-11-14T09:28:45Z	1479115725899	2016-11-14T09:37:39Z	1479116259229	4		My first experience with flyrobe was totally amazing . I had rented tuxedo for one day shoot . They gave me the best serive , they could give; that too at reasonable rate .				https://play.google.com/apps/publish?account=6499663341265583899#ReviewDetailsPlace:p=com.flyrobe.android&reviewid=gp:AOqpTOH-2-vLMy-EjCGSca92tTBSymFrzUzLbPn9mfdv9h-KQwNQgg4mJCo2znaNd1j0i4bn2azjiq1_dUucog
com.flyrobe.android	31	2.2.0	en	RM-1013	2016-11-14T09:39:47Z	1479116387584	2016-11-14T09:39:47Z	1479116387584	5	Good	beautiful collection of ethnic wear available on this flyrobe app . . . . . . simple and easy to use app compared to koovs :)				https://play.google.com/apps/publish?account=6499663341265583899#ReviewDetailsPlace:p=com.flyrobe.android&reviewid=gp:AOqpTOGatukF6HsrW_GGED-eUWKc6mJs0R5GGaBUew-bCqMPbdndrAcTD9lg_Vzl1s_cKvweyGx6oZkVXqa69g
com.flyrobe.android	31	2.2.0	en	X3_HK	2016-11-14T09:42:20Z	1479116540637	2016-11-14T09:42:23Z	1479116543596	5		Ordered a dress last week from roposo . . . . the quality of the dress was not at all comparative to the dress they displayed on the internet . . . . comparatively flyrobe is the best app to shop from ! !				https://play.google.com/apps/publish?account=6499663341265583899#ReviewDetailsPlace:p=com.flyrobe.android&reviewid=gp:AOqpTOHNve2fr2RKBm4QofXgKWxRt4Soz399wnKQhq-1eGxQe_LM2Tm1gZuwz0QxvgouvCOMdHPQjka_RJZPMA
com.flyrobe.android	31	2.2.0	en	ELUGA_I	2016-11-14T09:44:20Z	1479116660984	2016-11-14T09:44:23Z	1479116663820	5		Very quick and easy to order . . . . received my dress prefectly on time before my important event ! ! Career saving app :P Thank flyrobe for renting me such a beautiful dress ! !				https://play.google.com/apps/publish?account=6499663341265583899#ReviewDetailsPlace:p=com.flyrobe.android&reviewid=gp:AOqpTOEYHrE2WahZHGUCZwi_oQbpLWI-yEBkOjWr5KRdYASSuVLe2_j0kOPcSi4i6IGo7c0zyUk09bd2ekwhlg
com.flyrobe.android	31	2.2.0	en	HWHol-U	2016-11-14T09:48:56Z	1479116936583	2016-11-14T09:48:56Z	1479116936583	5	Good	Gathered and ordered 5 one piece on rent for me and my friends . . . . . rent was low with exceptional discount ! ! superb app for money saving :D				https://play.google.com/apps/publish?account=6499663341265583899#ReviewDetailsPlace:p=com.flyrobe.android&reviewid=gp:AOqpTOH4tNoayxA2l2bQH-WCy3lByEnQP41302zwHQRdghSmicjWbgoSoIopeNVq0QOxEhmVIKt7UpKqnklkZg
com.flyrobe.android	31	2.2.0	en	j23g	2016-11-14T09:40:13Z	1479116413854	2016-11-14T09:49:44Z	1479116984320	5	Loved it..	Amazing experience with this app . . . . . . i order all of my clothes from this site . . . . . never disappointed . . . . beautiful variety of dresses and best site for women shopping &lt;3				https://play.google.com/apps/publish?account=6499663341265583899#ReviewDetailsPlace:p=com.flyrobe.android&reviewid=gp:AOqpTOGefmNdW94WYEExaX-qNpROV_HouVQjAg9gXjyX-dm8068hAy3PsCNQ6kOpXGS56WKfXfZSfYUO2S0niw
com.flyrobe.android	31	2.2.0	en	ELUGA_Turbo	2016-11-14T09:49:58Z	1479116998743	2016-11-14T09:49:58Z	1479116998743	5		Get your order on time , use it for 3 days and the pickup will be available at your door steps to receive the dress . . . . very magneficiant service provided by flyrobe for women shopping :D				https://play.google.com/apps/publish?account=6499663341265583899#ReviewDetailsPlace:p=com.flyrobe.android&reviewid=gp:AOqpTOE-rCo-G_wh1-EemQJsaEBneXgdg8RBFGX5p53to2NNihu2biUIRlXRGhBmOrUgQGDrIuhSSBCk8yv8RA
com.flyrobe.android	31	2.2.0	en	kenzo	2016-11-14T10:58:38Z	1479121118440	2016-11-14T10:58:38Z	1479121118440	1	Worst service	This is a fraud company. Worst service I booked a jacket which was never delivered to me and at the end moment I have to go and purchase one before the event. There was no response from customer care as well. Don't trust them.				https://play.google.com/apps/publish?account=6499663341265583899#ReviewDetailsPlace:p=com.flyrobe.android&reviewid=gp:AOqpTOGuwp2exRduK1A5RowezZ6Qla2xgThHh_WLqX0BFYFU809axcij9NEoVtBf3Kpqg_iCw4Ie3qad74MxXQ
com.flyrobe.android	31	2.2.0	en	lux_uds	2016-11-14T15:02:23Z	1479135743187	2016-11-14T15:02:23Z	1479135743187	2		I am vry disappointed.Though I booked my order about 20 days prior n they confirmed it too. But They cancelled my order jst five days before delievry date bcz that dress was not available.				https://play.google.com/apps/publish?account=6499663341265583899#ReviewDetailsPlace:p=com.flyrobe.android&reviewid=gp:AOqpTOE3DIOkPfF2LXqMQ2K5KYRXNkSmOq9FytoG_ywv8AUkl_vh4FHqbj1Oapu-Ew9PWeX5bRkYfZQD7MTEjA
com.flyrobe.android	27	2.0.2	en	osprey_ud2	2016-06-27T14:21:31Z	1467037291520	2016-11-14T16:11:26Z	1479139886920	5		For how long we can rent the dress and what would be the charges. please revert asap as I need a dress	2016-06-28T09:42:01Z	1467106921374	Hi Swati, The rental period is 3 days for western outfits and the rental amount is mentioned below each outfit. For ethnic outfit, you can keep the outfit for either 4, 6 or 8 days. For more information, you can call us at +91-8433900130 or email us at orders@flyrobe.com. We will be happy to assist you. Thanks, Team Flyrobe.	https://play.google.com/apps/publish?account=6499663341265583899#ReviewDetailsPlace:p=com.flyrobe.android&reviewid=gp:AOqpTOEC9eFwwpIf4FnwRZyi92WQPa1LeKWZVbfwEtFFwnFwqSsBVa-8pyO9SQCUdkd2CntovWvxt0XE4v5pzQ
com.flyrobe.android			en	GIONEE_GBL7360	2016-11-14T19:08:51Z	1479150531055	2016-11-14T19:08:51Z	1479150531055	5						
com.flyrobe.android	31	2.2.0	en	land	2016-10-15T18:10:35Z	1476555035007	2016-11-15T09:02:54Z	1479200574568	5		Downloaded this app to get a discount on a beautiful dress while a got a lot many other offers which i can enjoy even further ! ! super app for women shopping ! !	2016-10-16T02:18:53Z	1476584333798	Hi Shubham, Thank you so much for your review! We are glad you enjoyed your Flyrobe experience! Hope to serve you again very soon. Best, Team Flyrobe	https://play.google.com/apps/publish?account=6499663341265583899#ReviewDetailsPlace:p=com.flyrobe.android&reviewid=gp:AOqpTOE_wr1USrA5pGVAXb-wAUQ_7O7_qqF9nnCtCLGgPXZgqVtOT4I4p1cCXfFACKlf6UwoUm_Gxcibq1f3bA
com.flyrobe.android			en	fortuna3g	2016-11-15T09:04:58Z	1479200698010	2016-11-15T09:04:58Z	1479200698010	5	nice	Received a gift from my aunt . . . she ordered that dress from this site and when i came up to checkout the collection . . . . i was simply amused to see such a great variety of dresses ! !				https://play.google.com/apps/publish?account=6499663341265583899#ReviewDetailsPlace:p=com.flyrobe.android&reviewid=gp:AOqpTOHYjnTCHGsGqUCqIbVE6BU1W1AExoidG-TgWtnJZJJNTWANyU6jOX9knkqYDHaAYaNcuMv0a7vMTTI6Xg
com.flyrobe.android			en	kenzo	2016-11-15T09:07:43Z	1479200863722	2016-11-15T09:07:43Z	1479200863722	5		Frankly speaking . . . best site ever came across for women shopping ! ! received amazing discount on a beautiful dress and received my order on time ! ! amazing experience ! !				https://play.google.com/apps/publish?account=6499663341265583899#ReviewDetailsPlace:p=com.flyrobe.android&reviewid=gp:AOqpTOH98T_gs7AvWwjjxpQ8J629LkgM4J5ul-HeEZjdx2datgAKGHS6Ww_S8ujsU_nvfGq1dtTnmuSEwyVlhA
com.flyrobe.android	31	2.2.0	en	kenzo	2016-11-15T09:09:45Z	1479200985630	2016-11-15T09:09:45Z	1479200985630	5		Beautiful collection of ties . . . . . elegent and royal as well as cool and classy . . . . all types of variety available ! ! great experience ! ! best site compared to roposo				https://play.google.com/apps/publish?account=6499663341265583899#ReviewDetailsPlace:p=com.flyrobe.android&reviewid=gp:AOqpTOGfNJBhRLRmmfOYIw2lmTKGd2tUQX1OP-TQlLJUyKHWTUNLeHj_XybReWD9ryaQxHT5ohCG-f_9jHhqxQ
com.flyrobe.android			en	LS-4505	2016-11-15T09:10:14Z	1479201014894	2016-11-15T09:10:14Z	1479201014894	5		If you want to rent clothes online I would totally recommend you to get this app that has a lot of great production services available !				https://play.google.com/apps/publish?account=6499663341265583899#ReviewDetailsPlace:p=com.flyrobe.android&reviewid=gp:AOqpTOFSTQD8T3ztNtAfgSCXM0CoaxAezxTB0SbLoGFBugLScABz-h-jNDMo_RYfU776VZq6TdljbGy3-QNhiA
com.flyrobe.android	31	2.2.0	en	kenzo	2016-11-15T09:11:00Z	1479201060603	2016-11-15T09:11:00Z	1479201060603	5		I have been using this app for quite long and this application provided me rental process services which are not easily available online , totally superb and awesome !				https://play.google.com/apps/publish?account=6499663341265583899#ReviewDetailsPlace:p=com.flyrobe.android&reviewid=gp:AOqpTOH6i5Mx-hbOAJHMH4GOT2D6dY3-aKyX2NywTcOJvDYkVWMXpBDjgs4IqZtDL-SX7Ng7cGY-uxuT3kLrmQ
com.flyrobe.android			en	HM2014818	2016-11-15T09:11:47Z	1479201107490	2016-11-15T09:11:47Z	1479201107490	5		I was surprised and my office colleagues also equally surprised at the quality and the great clothes that I got from flyrobe , just better than voonik and koovs !				https://play.google.com/apps/publish?account=6499663341265583899#ReviewDetailsPlace:p=com.flyrobe.android&reviewid=gp:AOqpTOGyAV-BH_NxxAUgFBy59kF3mLbrPLb2X1gzIN-DYC9olcm54hcNIWfR9AUd0gSgCTcDBLFlxKwF7oys3g
com.flyrobe.android	31	2.2.0	en	Y51L	2016-11-15T09:12:01Z	1479201121251	2016-11-15T09:12:08Z	1479201128271	5		It has such a nice service to take clothes on rent and pay their rent , use it , and return back , its will save your time , lots of money !				https://play.google.com/apps/publish?account=6499663341265583899#ReviewDetailsPlace:p=com.flyrobe.android&reviewid=gp:AOqpTOHtId3NquWn6btNS2C3eZkf81Lze10ljtZEJ8H0OzNMcfQHmmlPdDumfctUGnud3QAhw-q_a412v0WMCg
com.flyrobe.android	31	2.2.0	en	e73g	2016-11-15T09:13:02Z	1479201182232	2016-11-15T09:13:02Z	1479201182232	5		Superb and amazing designs at very reasonable prices and on a rent basis too . I cant find a better app than this till date .				https://play.google.com/apps/publish?account=6499663341265583899#ReviewDetailsPlace:p=com.flyrobe.android&reviewid=gp:AOqpTOF9nu7mX00dV6V6sevegOyMfzz6-ba30tS7llo5FkYESjSorjWrecxpDDkV8W2qeChP21E_X2Iekc0CdQ
com.flyrobe.android			en	A6020a46	2016-11-12T10:04:19Z	1478945059854	2016-11-15T09:16:37Z	1479201397698	5		cool services of an application for people who would love to shop online definitely try this one you like				https://play.google.com/apps/publish?account=6499663341265583899#ReviewDetailsPlace:p=com.flyrobe.android&reviewid=gp:AOqpTOHNdB-wVSTvmASEuJGQy-T0apj2mc5ZlJS9WBdBtszaUpe4OEGRA_E_KHHxt00ZG-LH7ueKmSP7UPTUcw
com.flyrobe.android	31	2.2.0	en	GiONEE_GBL7319	2016-11-15T09:16:51Z	1479201411518	2016-11-15T09:16:51Z	1479201411518	5		Flyrobe has the best collection of clothes and new trends but roposo has disappointed me does not have a good collection like this application does !				https://play.google.com/apps/publish?account=6499663341265583899#ReviewDetailsPlace:p=com.flyrobe.android&reviewid=gp:AOqpTOE234ryWY5rRsSp3fhPZ8RhUu7kfBIeocgHXl1ixzpPShObmdHwjkzsmkLyOB5IKDcyLf-rof-qd4L4TQ
com.flyrobe.android	31	2.2.0	en	A7010a48	2016-11-15T09:17:39Z	1479201459739	2016-11-15T09:17:39Z	1479201459739	5		The delivery from flyrobe is never late and the collection is super awesome . What else do you want ? You can take clothes on rent from an online app .				https://play.google.com/apps/publish?account=6499663341265583899#ReviewDetailsPlace:p=com.flyrobe.android&reviewid=gp:AOqpTOHx7CDnA19bHGGjSGGTXI2B_AIRnd4k7KfI0FLHqHEOB8IN-SmkUICHs_z3tl-WdmwH6OUQzILXAQsl-A
com.flyrobe.android	31	2.2.0	en	A6020a46	2016-11-15T09:17:47Z	1479201467958	2016-11-15T09:17:47Z	1479201467958	5		Flyrobe always keeps the latest trends updated not like voonik . com . This app is the best you can get online and just download it don’t think much !				https://play.google.com/apps/publish?account=6499663341265583899#ReviewDetailsPlace:p=com.flyrobe.android&reviewid=gp:AOqpTOGV9ERAST45V4K8DAPyAeTzcwN9odmpLJgYOebX-QYEUd902Vwca17XjsAXPiWtzdcGl8IE-8JW7BNvTg
com.flyrobe.android	31	2.2.0	en	j5lte	2016-11-15T09:12:13Z	1479201133869	2016-11-15T09:18:04Z	1479201484228	5		Saturday night it was so much fun everyone loved whatever we were wearing that we got on rent from flyrobe . Just awesome and amazing job !				https://play.google.com/apps/publish?account=6499663341265583899#ReviewDetailsPlace:p=com.flyrobe.android&reviewid=gp:AOqpTOHvp7saXlhFwdpIecEF7BFHnC0Fsl7PhIeHh9nq_h2OxBdiQVcgjf2GamXZqqZX11pl2F64exG0-XyvXQ
com.flyrobe.android	31	2.2.0	en	core33g	2016-11-15T09:19:03Z	1479201543041	2016-11-15T09:19:03Z	1479201543041	5		Designers like Mr Button , Ekaksh , Bubber Couture provided their magneficiant designs on rent . . . . . super amazing quality with elegent and classy look ! ! best site compared to koovs . . . .				https://play.google.com/apps/publish?account=6499663341265583899#ReviewDetailsPlace:p=com.flyrobe.android&reviewid=gp:AOqpTOHb0gGo-dZ4we4y__lS0VRPz4HvZzcDsPO5_QoE_Mfcqi_lhoA5hrTGT8kyNUYt0g5wjT9IBlAGT6Jb6A
com.flyrobe.android	31	2.2.0	en	core33g	2016-11-15T09:18:43Z	1479201523376	2016-11-15T09:19:09Z	1479201549541	5		Always enjoy shopping from this app that gives you clothes on rental basis . This app never fails to impress me and my family .				https://play.google.com/apps/publish?account=6499663341265583899#ReviewDetailsPlace:p=com.flyrobe.android&reviewid=gp:AOqpTOGlH7q25Q9yrS-ir3BS0P2XN9Mdht7CsY4yCS4SmMggkcJqAsZ9piMTkadnoBhKYKoGPLUtxZEqCvm24A
com.flyrobe.android	31	2.2.0	en	arubaslim	2016-11-15T09:19:32Z	1479201572967	2016-11-15T09:19:32Z	1479201572967	5		The huge collection and wide variety of clothing this app has something very difficult to find in koovs and voonik ! They are just amazing !				https://play.google.com/apps/publish?account=6499663341265583899#ReviewDetailsPlace:p=com.flyrobe.android&reviewid=gp:AOqpTOG5O_Gfo-C9kMI-IKbtyglBNGl7BkZ15NSjaht3P0Xo1HA0CRNwI5Qz8hk6Abpjtc0QrQXKpIiUsLQ20g
com.flyrobe.android			en	LS-4004	2016-11-15T09:20:26Z	1479201626479	2016-11-15T09:20:26Z	1479201626479	5	Usefull app	Very versatile collection flyrobe app has till date , no one can be disappointed , to rent clothes online at a cheaper cost and enjoy the services .				https://play.google.com/apps/publish?account=6499663341265583899#ReviewDetailsPlace:p=com.flyrobe.android&reviewid=gp:AOqpTOGkfh8QB8sR-al2SHs2vBLgQ0Cr1mVqKFwC_hKoAVBVHTb2dSuM7UTTllKp-d7AqSe8hhXXXKdPaVwlqA
com.flyrobe.android	31	2.2.0	en	kenzo	2016-11-15T09:20:49Z	1479201649548	2016-11-15T09:20:49Z	1479201649548	5		I must say that I am delighted and I tried hard to find an app that works this way and provides you clothes and accessories on rental basis !				https://play.google.com/apps/publish?account=6499663341265583899#ReviewDetailsPlace:p=com.flyrobe.android&reviewid=gp:AOqpTOFM1jB8OVo_wAZUD14sLCq6C5HYpA2JDH9sGsMDeOwLXGZGLXBvM5ddHc4OCVsXOpLlGgAUi-hkvEE0vQ
com.flyrobe.android	31	2.2.0	en	j2lte	2016-11-15T09:23:38Z	1479201818056	2016-11-15T09:23:38Z	1479201818056	5		Flyrobe works the best for me ! There is nothing quite as good as this app to rent clothes on the go and get such good services .				https://play.google.com/apps/publish?account=6499663341265583899#ReviewDetailsPlace:p=com.flyrobe.android&reviewid=gp:AOqpTOFAmWGUnBLG-nf-4eznEQy9e1TAMvXAyec8AV04pAAkd1fl8B52pyQ0aNwao-zZQuc9UQkkxmbeGd6hYg
com.flyrobe.android	31	2.2.0	en	scx35_sp7731gea_hdr	2016-11-15T09:25:35Z	1479201935649	2016-11-15T09:25:35Z	1479201935649	5		I never expected that such a small app company would be so great ! They are providing you clothes on rent better than any online application .				https://play.google.com/apps/publish?account=6499663341265583899#ReviewDetailsPlace:p=com.flyrobe.android&reviewid=gp:AOqpTOF1_Lr2gdHq8SsDYyzBvF6D12sC5okuyOdzE4y16rQJBG1VPQz0GhppzWFwALlNzqOYiepw4L7Dvvk8xw
com.flyrobe.android			en	lava6735p_sp31_lte	2016-11-15T09:26:27Z	1479201987204	2016-11-15T09:26:27Z	1479201987204	5		Online shopping made so easier on flyrobe that you can take clothes on rent and enjoy the services . This app is simply awesome !				https://play.google.com/apps/publish?account=6499663341265583899#ReviewDetailsPlace:p=com.flyrobe.android&reviewid=gp:AOqpTOHh79IybLhunZzs_-oCMUK4Tv2mSaWM4vra5EBDkt0sikVIkU88ccszhmygAPDPh1l0aLzuUBbBNcO0lg
com.flyrobe.android	31	2.2.0	en	j7elte	2016-11-15T09:29:42Z	1479202182690	2016-11-15T09:29:42Z	1479202182690	5		I would definitely go for this float rental service they have a lot of good material and many varities , also about new arrival !				https://play.google.com/apps/publish?account=6499663341265583899#ReviewDetailsPlace:p=com.flyrobe.android&reviewid=gp:AOqpTOGMjZxrBl74roCsPGbVF9s9e9yB5T74OcxBcoaiE9Pi7vrYg41YifXUKPambfR01OKpTjhfMu_c1mGQUQ
com.flyrobe.android	31	2.2.0	en	kenzo	2016-11-15T09:31:43Z	1479202303093	2016-11-15T09:31:43Z	1479202303093	5		Very resourceful app to get beautiful clothes on rent . . . . . Dry cleaned and steam pressed suits provided for making us look more and more awesome and elegent ! !				https://play.google.com/apps/publish?account=6499663341265583899#ReviewDetailsPlace:p=com.flyrobe.android&reviewid=gp:AOqpTOGaxu514TxPIgJtmXopkYvaIFTFWGDR-qnm4eExJEmvkbxyQHCScx0mubEH0HRQ7v0mLaqOFEyvVq3-MA
com.flyrobe.android	31	2.2.0	en	Y21L	2016-11-15T09:32:32Z	1479202352523	2016-11-15T09:32:39Z	1479202359594	5	Good	Ordered a beautiful dress and saved a lot of money . . . . free shipping as well as cash on delivery feature available . . . . . best site to get clothes on rent ! !				https://play.google.com/apps/publish?account=6499663341265583899#ReviewDetailsPlace:p=com.flyrobe.android&reviewid=gp:AOqpTOF0w-9V-uO9__tyQFi_DLzTPEyhqT4SxAZUSkFpE3xa8wGDoa-lwqdggv8GL2_hdqJUAI5QCwiDiYp22A
com.flyrobe.android	31	2.2.0	en	Aqua Craze	2016-11-15T09:34:56Z	1479202496417	2016-11-15T09:34:56Z	1479202496417	5		Had a bad experience with koovs when my friend suggested me this site for good experience . . . . . i owe him one for suggesting me this app :D really resourceful and money saving ! !				https://play.google.com/apps/publish?account=6499663341265583899#ReviewDetailsPlace:p=com.flyrobe.android&reviewid=gp:AOqpTOEDUD9W1xLimjUji4KjH8XsD3JaLNeeHZ0_NMGW_vR9L-sdv8gLB09GPOozkAyjeRWqkyHZMwgkhQxzFw
com.flyrobe.android	31	2.2.0	en	surnia_uds	2016-11-15T09:35:01Z	1479202501764	2016-11-15T09:35:01Z	1479202501764	5		Get 25% off on all ethnic wear collections . . . . . superb offer for clothes lovers like us ! ! must download app for amazing experience &lt;3				https://play.google.com/apps/publish?account=6499663341265583899#ReviewDetailsPlace:p=com.flyrobe.android&reviewid=gp:AOqpTOH_MakEA-LX_iblll0lSBX7yosltGNT_RY51Ig3rIT0AGUfPEzzgtbQMxhsS4Iq7oI9JBnha2YXqh_8BA
