com.flyrobe.android			en	j2xlte	2017-03-15T09:44:52Z	1489571092949	2017-03-15T09:45:00Z	1489571100497	5		Make it amazingly simple it as one of the excellent applications that you can yet and it is truly worth it definitely fun app to apply				https://play.google.com/apps/publish?account=6499663341265583899#ReviewDetailsPlace:p=com.flyrobe.android&reviewid=gp:AOqpTOEWkF0rf3zbpDePKyJeyA9Q2h9DlIG-qsZvhHYvG0XTIsrh6hfJbP2QidoxsNq2kf9cvYHeRN-XG5ovhg
com.flyrobe.android	35	2.2.4	en	V3	2017-03-15T09:49:49Z	1489571389848	2017-03-15T09:50:16Z	1489571416325	3		how to get such a lot of offers And discounts on renting garments on line you'll be amazed to discover so many things effortlessly				https://play.google.com/apps/publish?account=6499663341265583899#ReviewDetailsPlace:p=com.flyrobe.android&reviewid=gp:AOqpTOEIOu43he4z55nuYJNtUf2J9hmoATMihHa2fNYhk6rjmgOB91MVEr1pja8vxKpppfvSBks25hi673AOEQ
com.flyrobe.android	35	2.2.4	en	condor_umtsds	2017-03-15T09:50:16Z	1489571416150	2017-03-15T09:55:15Z	1489571715776	5		exceptional utility the services are honestly correct i found that it's miles one of the quality applications to rent garments online				https://play.google.com/apps/publish?account=6499663341265583899#ReviewDetailsPlace:p=com.flyrobe.android&reviewid=gp:AOqpTOF3fFR3x_C3yssJG-zU_Vt_Vy6OW6KjizTm86zKSIVn7ErIJE0XbTYxT23oX-XjZx04GwZ7P9ft1J_zLA
com.flyrobe.android	35	2.2.4	en	j2lte	2017-03-15T09:55:55Z	1489571755113	2017-03-15T09:56:00Z	1489571760393	5		easy and smooth to apply utility a lot better than one unique and Myntra like applications in which you have got to buy your clothes renting is a lot less difficult				https://play.google.com/apps/publish?account=6499663341265583899#ReviewDetailsPlace:p=com.flyrobe.android&reviewid=gp:AOqpTOGMFpNXTG-33TURx_efikpJcs1omSUta-uTko7pIJc4xPt2uUfFQ15liGVBn0zTwVgKN9ht9NDCTGQ9Sg
com.flyrobe.android	35	2.2.4	en	Y51L	2017-03-15T09:57:14Z	1489571834446	2017-03-15T09:58:22Z	1489571902995	5		Amazingly woman it turned into not the quality applications that I referred to as and it's miles simply cool to you can enjoy the shopping experience with this take place you line santa Claus are extremely good services that you can use to get all the goods which you want to wear so effortlessly is a ought to have products				https://play.google.com/apps/publish?account=6499663341265583899#ReviewDetailsPlace:p=com.flyrobe.android&reviewid=gp:AOqpTOEwurhbOc9KJYO5xpt8iv14N1f057pfJu1VwwedYF01rOQoTYmsfTqqYVpQFypOMgE5usF7cepRR7dOww
com.flyrobe.android	35	2.2.4	en	ASUS_Z00L_63	2017-03-15T10:03:20Z	1489572200547	2017-03-15T10:03:30Z	1489572210931	5		Cool utility cool experimental factor unique idea it's miles absolutely true to use				https://play.google.com/apps/publish?account=6499663341265583899#ReviewDetailsPlace:p=com.flyrobe.android&reviewid=gp:AOqpTOGbaLuMvJwXpDfNnLStfGXv63pQ0t7IPqu9YVz9x7s80KfIagar9YDUZVicuqrO2L0TsdThBQDyoPRtuA
com.flyrobe.android	35	2.2.4	en	kenzo	2017-03-15T09:56:39Z	1489571799599	2017-03-15T10:13:57Z	1489572837737	5		Kishan outstanding charges it was definitely really worth it i really like to use utility over and over you want the entirety in that I desired for the software that I were given a application for a long time and this rental services. You may surely fun this application you can be sure that you get all the remarkable products and clothes for most inexpensive charge it and hire without problems with the SAP really cool and Panti use				https://play.google.com/apps/publish?account=6499663341265583899#ReviewDetailsPlace:p=com.flyrobe.android&reviewid=gp:AOqpTOGkIfRRaFIdxgKOZRHIxBDLToL4LxLx_6WbDOmUTq7CoG7Jfe2jiprQ3VijtBCel-i_AAhJk6TgC-Bqjw
com.flyrobe.android	35	2.2.4	en	grandprimevelte	2017-03-15T10:17:03Z	1489573023073	2017-03-15T10:19:47Z	1489573187712	5		once I began the usage of this software I in no way bought anything on line it became all rented through this application this is so much fun				https://play.google.com/apps/publish?account=6499663341265583899#ReviewDetailsPlace:p=com.flyrobe.android&reviewid=gp:AOqpTOFP5xHlusTZvkSNIRlHugy5kk6Cugl5ywqXor3nw3lJvOW-28lr4HFjhrTlvftIG4pc5KpTEschnWswLg
com.flyrobe.android	35	2.2.4	en	P1ma40	2017-03-15T10:24:23Z	1489573463991	2017-03-15T10:24:32Z	1489573472681	5		preferred product and i can glaringly hire it time and again every time I need any such first-rate experience uses application				https://play.google.com/apps/publish?account=6499663341265583899#ReviewDetailsPlace:p=com.flyrobe.android&reviewid=gp:AOqpTOGIw5eaRXJOIg8LB1QUTAT7xSqMQMhzhS5S1Lr8-UYrw0lagZ6NnFgyJR7D6uszT6go-TXU4waDF3phRg
com.flyrobe.android	35	2.2.4	en	Y51L	2017-03-15T10:29:06Z	1489573746557	2017-03-15T10:29:12Z	1489573752764	5		Makes it help an application to use you could use it once precise apartment market for purchasing at the popular merchandise				https://play.google.com/apps/publish?account=6499663341265583899#ReviewDetailsPlace:p=com.flyrobe.android&reviewid=gp:AOqpTOFzKyAFuavbwkoGTMaMK2Bvxc59PxJXdjmrxIEUPvI4pDdSgGG5aPrXEmTrkh3hmeAZ5WluXWrXAWz9aw
com.flyrobe.android	35	2.2.4	en	land	2017-03-15T10:29:33Z	1489573773267	2017-03-15T10:29:38Z	1489573778573	5		add-ons to be had on with all the exceptional filters on-line which you would get the entirety so easily				https://play.google.com/apps/publish?account=6499663341265583899#ReviewDetailsPlace:p=com.flyrobe.android&reviewid=gp:AOqpTOE3wRw6PneTVGpu5zxBlt3PIeRoXSs7hMDS9XTBhHbcHicpA882qI28rhZ9m-tpI7hO6z3zJk1Yb25O8g
com.flyrobe.android	35	2.2.4	en	A7020a48	2017-03-15T10:38:21Z	1489574301817	2017-03-15T10:38:44Z	1489574324215	5		Ringly excellent app can be the use of this application time and again this is a should have for your cellphone				https://play.google.com/apps/publish?account=6499663341265583899#ReviewDetailsPlace:p=com.flyrobe.android&reviewid=gp:AOqpTOFKFXgzReBWEPYn9JBlyRBGtY2nf0SG-L9QuUQKg8SGI33Xr-xUFwTd71Zck8UAiQ23tc0_CryjCLJfEg
com.flyrobe.android			en	LS-5016	2017-03-02T09:10:00Z	1488445800321	2017-03-15T10:39:18Z	1489574358625	5		With the helps of this app Search for the best outfit party and take it on rent is become so easy for me. It is the most easier way of shopping especially from brands.				https://play.google.com/apps/publish?account=6499663341265583899#ReviewDetailsPlace:p=com.flyrobe.android&reviewid=gp:AOqpTOEUWe-qzox7vjOXr9CGiPs4YH_B-1-xJQ23kW5Ad6H4WXpinuKIvVJdUKi71F3oPTZm9sx-Yxu6y6S0hQ
com.flyrobe.android			en	Cloud_Cube	2017-03-15T10:43:59Z	1489574639076	2017-03-15T10:44:17Z	1489574657047	5		services sincerely excellent application i have been the usage of software for pretty a long time now to be happy with the enjoy hold all the garments that you want with you for a limiteless. Of time is the Krishna option this is truly beneficial for all the peoples				https://play.google.com/apps/publish?account=6499663341265583899#ReviewDetailsPlace:p=com.flyrobe.android&reviewid=gp:AOqpTOHzerk0M3mO6gAcUgtGZGlZC-TMfKjUJJswGxY2_KwWJYxLNPSTFzCD7lugWFti9SRbhsO-RWJCgCrcBQ
com.flyrobe.android	35	2.2.4	en	A51	2017-03-15T10:44:28Z	1489574668401	2017-03-15T10:44:35Z	1489574675131	5		exquisite apP to 4 days is easy you can also rented for extra days if you want to the apartment services virtually reasonably-priced				https://play.google.com/apps/publish?account=6499663341265583899#ReviewDetailsPlace:p=com.flyrobe.android&reviewid=gp:AOqpTOEIwH3DOULulo7_BJK5gpo6OGZk9ZnITCg5buNKUP-gCZpvK1PZ5ZFgh4epqVmiQGSKPVftJ0gObTqA4g
com.flyrobe.android			en	Aqua_4G+	2016-10-27T06:09:31Z	1477548571846	2017-03-15T10:46:57Z	1489574817219	1		data I love the way I provide all the services so easily that is awesome to use this application from time to time				https://play.google.com/apps/publish?account=6499663341265583899#ReviewDetailsPlace:p=com.flyrobe.android&reviewid=gp:AOqpTOGBle-wn8BO1r6Y6SmdlpEg7KWRYPy6i9HFsTqrkosycF7ZDuiyl2tNGF_1Rab12rgWBGitslksgjla-Q
com.flyrobe.android	35	2.2.4	en	surnia_uds	2017-03-15T10:51:57Z	1489575117566	2017-03-15T10:52:14Z	1489575134309	5		turned into dresser of range of clothes and accessories from popular and comfort brands it's far simply wonderful and 40 makes use of software				https://play.google.com/apps/publish?account=6499663341265583899#ReviewDetailsPlace:p=com.flyrobe.android&reviewid=gp:AOqpTOFiBGZ2gkY4rMe9BcFyXDQJOy4JS62y5grfnYbFt2Ky2XJZ-AfRt7X7b3nu9vSmTDXLN_akBXcgBpyxpQ
com.flyrobe.android	35	2.2.4	en	A6020a40	2017-03-15T10:52:34Z	1489575154732	2017-03-15T10:52:41Z	1489575161008	5		Guda for renting garments online you can get everything so without problems if you have a passion for fashion that is the must have packages				https://play.google.com/apps/publish?account=6499663341265583899#ReviewDetailsPlace:p=com.flyrobe.android&reviewid=gp:AOqpTOGUvhXp0-THr-BVRynaAKhivLoZZ_lMPowyVxhHDuMySg_KaKK_P-wOuqR-n_-ReQUkHFL3TcffZHgo8A
com.flyrobe.android	35	2.2.4	en	a5xelte	2017-03-15T18:08:53Z	1489601333914	2017-03-15T18:16:18Z	1489601778521	1		I had received a mail regarding the confirmation of refund of my security deposit 2 weeks back..but I am yet to receive the refund..when contacted them they didn't respond back..dont expect your security deposit amount to be credited in your accnt by flyrobe..i am about to report this issue in consumer Forum. DON'T USE THIS APP..It's a scam				https://play.google.com/apps/publish?account=6499663341265583899#ReviewDetailsPlace:p=com.flyrobe.android&reviewid=gp:AOqpTOHzvRoYL_b6oWlKwTaft1iXdCbPOLyIp_75srTmro8qHTVAVzxLldHD1tVmElxV2YxljYG7CUKvBa__IA
com.flyrobe.android			en	A0001	2017-03-15T18:53:16Z	1489603996437	2017-03-15T18:53:20Z	1489604000586	4						
com.flyrobe.android	35	2.2.4	en	OnePlus3	2017-03-15T19:30:43Z	1489606243714	2017-03-15T19:31:26Z	1489606286061	1						
com.flyrobe.android	35	2.2.4	en	Q345	2017-03-16T06:35:31Z	1489646131895	2017-03-16T06:35:40Z	1489646140636	5		looking with the tapestry Z I completely love this utility it has everything online and amazingly Pan software to apply				https://play.google.com/apps/publish?account=6499663341265583899#ReviewDetailsPlace:p=com.flyrobe.android&reviewid=gp:AOqpTOHBhSjGhrZwYe5eIppj0ymay_X_KId4TQWLtXY9I71znhAPgrABES7cNerYZSlo5UqxLznIzp5IwQ7P6A
com.flyrobe.android			en	Z1	2017-03-16T06:36:06Z	1489646166123	2017-03-16T06:36:14Z	1489646174707	5						
com.flyrobe.android			en	HM2014818	2017-03-16T06:43:25Z	1489646605820	2017-03-16T06:43:44Z	1489646624299	5		region and control orders on the move amazingly exact after IT services cool app to use				https://play.google.com/apps/publish?account=6499663341265583899#ReviewDetailsPlace:p=com.flyrobe.android&reviewid=gp:AOqpTOE6MEtomAX8C7w83uG8gTD1NBZQmWqz0X5-txOBWuQ2766q_MU1p8hWFyeMV1G4aLIfx9O7hL2sc5umFA
com.flyrobe.android	35	2.2.4	en	HL-L51P	2017-03-16T06:45:21Z	1489646721446	2017-03-16T06:45:35Z	1489646735448	4		The purchases you're very clean and that they allow you to make a very clean and protection code to no concerns regarding the fee techniques and offerings for renting clothes				https://play.google.com/apps/publish?account=6499663341265583899#ReviewDetailsPlace:p=com.flyrobe.android&reviewid=gp:AOqpTOGXVWlEdpeuwE6T6v_xGYxl2AVl6V9TP48E9wXs41c_5rh3AnKp-t1kZ4oGKdxsw4W27sO0JF_FF4m3BQ
com.flyrobe.android	35	2.2.4	en	GIONEE_GBL7529	2017-03-16T06:53:53Z	1489647233985	2017-03-16T06:54:00Z	1489647240736	5		Grid programs or offerings of the application makes it in reality thrilling to apply on line one of the best packages that i have ever attempted				https://play.google.com/apps/publish?account=6499663341265583899#ReviewDetailsPlace:p=com.flyrobe.android&reviewid=gp:AOqpTOG17GMV1rVcvbvL_3nPAsbfd2dIA96U7IIpo5Q51IexhmXj7Kyul7OIHozgLYzavJwaEf9s6pkVnsWnAg
com.flyrobe.android	35	2.2.4	en	land	2017-03-16T06:56:01Z	1489647361831	2017-03-16T06:56:06Z	1489647366265	5		Veg bargain offers and schemes that this utility gives over and over satisfied Days is application definitely cool				https://play.google.com/apps/publish?account=6499663341265583899#ReviewDetailsPlace:p=com.flyrobe.android&reviewid=gp:AOqpTOFSkZCdP_6UhpSIscg9SH52_RNgK0SM1Wx9BBoZgin02HA-OrCkrqSmP54aDwJHxu3zr2CY9Xp8uqXBog
com.flyrobe.android	35	2.2.4	en	grandprimevelte	2017-03-16T06:59:01Z	1489647541673	2017-03-16T06:59:18Z	1489647558434	5		Sadak image amazingly costly but for one time use you could manifestly lease it from this application's awesome to have the app				https://play.google.com/apps/publish?account=6499663341265583899#ReviewDetailsPlace:p=com.flyrobe.android&reviewid=gp:AOqpTOECTVmQAixdkk7g22AaeWRddjiUbyicf3Y5tw1NiOgxcLD4W0Gb0vzQCpdQO9bG77lNz70FUQlxYTjXHg
com.flyrobe.android	35	2.2.4	en	D5322	2017-03-16T06:57:27Z	1489647447134	2017-03-16T07:00:08Z	1489647608289	4		follow many application reputation a lot higher to rent then purchase clothes from Pune, Kerala higher to get the software free of charge right now				https://play.google.com/apps/publish?account=6499663341265583899#ReviewDetailsPlace:p=com.flyrobe.android&reviewid=gp:AOqpTOHEi5KUuqXUpJ_XQt1q5mTWtMcwn2d8v5iAWrbLqp7_aCpcralWtjuhGvWBQTgcazkdb074Q2ZxZJ4gmA
com.flyrobe.android	35	2.2.4	en	LS-5016	2017-03-16T07:04:34Z	1489647874795	2017-03-16T07:04:44Z	1489647884496	5		Vocational in which I definitely move for this utility the assist me to get all of the rental clothes without problems from the app				https://play.google.com/apps/publish?account=6499663341265583899#ReviewDetailsPlace:p=com.flyrobe.android&reviewid=gp:AOqpTOGa5TMiq5qTB1nz7K7Tm5BiO7Tlz3TpHC4KSZNAiFBRdOXlBl4IqTtscFPRWX-Qgqq20hfk6mUEtTuZ1Q
com.flyrobe.android	35	2.2.4	en	Q461	2017-03-16T07:07:14Z	1489648034377	2017-03-16T07:07:23Z	1489648043034	5		cool software interface it is truly a laugh in terms of renting clothes on-line is awesome to use				https://play.google.com/apps/publish?account=6499663341265583899#ReviewDetailsPlace:p=com.flyrobe.android&reviewid=gp:AOqpTOHmys8QKXbiE_LhAnsbtCvocRUCrqv4dGeBmRnq5PAATlpdCmug9qdr_IjQqi98whcc25zfB-2mmyvWmQ
com.flyrobe.android	35	2.2.4	en	mido	2017-03-16T07:12:12Z	1489648332976	2017-03-16T07:12:24Z	1489648344706	5		Cool software cool services i have been the usage of this software for truly long time now and it's miles totally amusing things you like				https://play.google.com/apps/publish?account=6499663341265583899#ReviewDetailsPlace:p=com.flyrobe.android&reviewid=gp:AOqpTOFaZPAamZ4hYcyuCNMWuuJ60DBCBx1KnBI4inDEUIOIRa47N0IV0jdi_KNAkLcveBxt_-dV9j5ns6bxRw
com.flyrobe.android	35	2.2.4	en	LS-5016	2017-03-16T07:12:59Z	1489648379504	2017-03-16T07:13:06Z	1489648386391	5		condo services are definitely reasonably-priced when it comes to lower priced clothes for amazing manufacturers also you may manage to pay for the cloths genuinely surely notable to have this app				https://play.google.com/apps/publish?account=6499663341265583899#ReviewDetailsPlace:p=com.flyrobe.android&reviewid=gp:AOqpTOERLJGAMY89ho0lSm8Rjf2NEhFYwBUnyb4Y0HVUQCbFEnDVYzaUTKtMyYdnfo8teEBh8yGXnyoGj5dL9w
com.flyrobe.android	35	2.2.4	en	j2lte	2017-03-16T07:14:04Z	1489648444471	2017-03-16T07:14:11Z	1489648451921	5		one of the most useful packages that i have when you uses software you'll be surprised use it time and again definitely cool				https://play.google.com/apps/publish?account=6499663341265583899#ReviewDetailsPlace:p=com.flyrobe.android&reviewid=gp:AOqpTOE41dt84cOsZQhsJs97ir83PTbIO4mQwEeDm43SooHMdXVLd16uBYEPBEUlefSIDCzdFiRzrB-j19PB8A
com.flyrobe.android	35	2.2.4	en	o5prolte	2017-03-16T07:24:05Z	1489649045581	2017-03-16T07:24:20Z	1489649060352	5		complete utility with so many cool functions available that you will be surprised to locate how good it's far it's miles one of the quality applications that i've ever got you like				https://play.google.com/apps/publish?account=6499663341265583899#ReviewDetailsPlace:p=com.flyrobe.android&reviewid=gp:AOqpTOFeqMh67alAGVkj0T8NbxUzjBFkAuXgbNYlijwMN2Ylm5OZcrsmYWuG6vRLh4jEEaRTBgU6m8FVUMzx5A
com.flyrobe.android	35	2.2.4	en	LS-5009	2017-03-16T07:27:10Z	1489649230677	2017-03-16T07:27:32Z	1489649252227	4		provide it A5 big name score this utility is amazing League could have with masses of amazing in unique features it's far really good				https://play.google.com/apps/publish?account=6499663341265583899#ReviewDetailsPlace:p=com.flyrobe.android&reviewid=gp:AOqpTOHSAlxNzH9YBFI9E33hLLZ9QWOjwLB_DcbSfYkjgC7HNwyxgfa3AXpANJ8aH_pkSWndsAo-fFBdpXvIoQ
com.flyrobe.android	35	2.2.4	en	A6600d40	2017-03-16T07:27:54Z	1489649274569	2017-03-16T07:28:05Z	1489649285945	5		read a lot higher that you can not solutely makes use of app for any sort of sports you may hire the whole lot to without problems Congress up				https://play.google.com/apps/publish?account=6499663341265583899#ReviewDetailsPlace:p=com.flyrobe.android&reviewid=gp:AOqpTOETFKvCZD5WpKZxb7qjyMGZ_5TNpKLB2dR6LEp9jasObYLul5h9cPIayrC9JZPaJ2XS-u5UK3JQpIZ3BQ
com.flyrobe.android	35	2.2.4	en	j7elte	2017-03-16T07:46:58Z	1489650418256	2017-03-16T07:47:20Z	1489650440454	5		on line shopping has in no way been easier condominium purchasing makes it so clean that i can get something I want at very cheap costs				https://play.google.com/apps/publish?account=6499663341265583899#ReviewDetailsPlace:p=com.flyrobe.android&reviewid=gp:AOqpTOH6xSEoVqPMtDqBs6kQJrk2JcDeihajVD78BIeyVbLmqVcAHTWfkhFapllkaAw3QqOdFeQD62K3QIyzzQ
com.flyrobe.android	35	2.2.4	en	j2lte	2017-03-16T08:03:19Z	1489651399930	2017-03-16T08:03:33Z	1489651413949	5		Cool application the interface is truely fantastic it's miles incredible to uses application had been the usage of it for pretty a long term now				https://play.google.com/apps/publish?account=6499663341265583899#ReviewDetailsPlace:p=com.flyrobe.android&reviewid=gp:AOqpTOHr9-JQBJIoNWKeVzn8KJog27McH6mqU7KYzox6YohXKUzCnSNWmhP3sIEB2jBMNA0pnMirqfGNpn0IyQ
com.flyrobe.android	35	2.2.4	en	E2363	2017-03-16T08:44:43Z	1489653883605	2017-03-16T08:44:50Z	1489653890240	5		Amazingly desirable and that i got this up after the recommendation of a chum and it turned into genuinely super they've everything that you need for condo services on-line				https://play.google.com/apps/publish?account=6499663341265583899#ReviewDetailsPlace:p=com.flyrobe.android&reviewid=gp:AOqpTOEk9uj8L01chFnqyTDpn7yFp4EYz-FaK_8z--aHsmmx0zLosLIglnBWdlDgXLLiVLOAWkvtfkiezGzeYw
com.flyrobe.android	35	2.2.4	en	land	2017-03-16T08:46:39Z	1489653999309	2017-03-16T08:46:44Z	1489654004586	5		With us software it and ensure that you are becoming all of the excellent product the right costs very notable app you have to totally get this app for all functions				https://play.google.com/apps/publish?account=6499663341265583899#ReviewDetailsPlace:p=com.flyrobe.android&reviewid=gp:AOqpTOH5cw5_j_VSdQN4x9DdEK9MOYG9LkzZq6LIqjY4e9arwuyhXG4VXz3WvQ_V3IVy2S9hgTok_ADAlvFv9g
com.flyrobe.android	35	2.2.4	en	SF1	2017-03-16T08:57:25Z	1489654645667	2017-03-16T08:57:36Z	1489654656100	5		painting online 4000 from hundreds of manufacturers and distinctive style merchandise is genuinely first-rate if it completely get this utility for all varieties of product				https://play.google.com/apps/publish?account=6499663341265583899#ReviewDetailsPlace:p=com.flyrobe.android&reviewid=gp:AOqpTOFLTFU9pEuihTz9IthPnQ4F5xlcPNT-_Ij2mvdLfPCyQam1PkGGVHriAp0cdaAy2zc3yzuT99a6BJApTA
com.flyrobe.android	35	2.2.4	en	grandprimevelte	2017-03-16T08:57:31Z	1489654651736	2017-03-16T08:57:36Z	1489654656979	4		movies because of him happening on this utility once in a while definitely cool and a laugh to apply				https://play.google.com/apps/publish?account=6499663341265583899#ReviewDetailsPlace:p=com.flyrobe.android&reviewid=gp:AOqpTOEVqWxwd-As3SsCiYRLE6aB2X8umXGvVBSAEmu9ZaenQ2n7wzTNdws05uoOJZgJ0nMcjRyohpVM-HGvCQ
com.flyrobe.android			en	Q345	2017-03-16T09:01:37Z	1489654897631	2017-03-16T09:01:43Z	1489654903766	5		manager orders on the go along with this software amazingly right features are to be had in SAP to without problems				https://play.google.com/apps/publish?account=6499663341265583899#ReviewDetailsPlace:p=com.flyrobe.android&reviewid=gp:AOqpTOHRfq_pWhNZutaNmH6Xsg1EJWrq8K9TIho1p-a8hccUEKtDMRQhi_8hN0c9SGNbm2s0xFLjU6f6UesOAA
com.flyrobe.android	35	2.2.4	en	A6600d40	2017-03-16T09:07:31Z	1489655251766	2017-03-16T09:08:18Z	1489655298574	5		LED and lowest expenses of goods and merchandise are to be had for on-line girls purchasing at one of the quality part of the destination genuinely better than voonik				https://play.google.com/apps/publish?account=6499663341265583899#ReviewDetailsPlace:p=com.flyrobe.android&reviewid=gp:AOqpTOHGr18_A5KzGu7MEYUeRjUnntuMHyroOvmqcMeg0zv30LhRY5asr8kXaya3fEh3E4KnOu4q1_YuD-HWMQ
com.flyrobe.android	35	2.2.4	en	Aqua_Classic	2017-03-16T09:10:00Z	1489655400229	2017-03-16T09:10:57Z	1489655457889	5		better app for girls purchasing. It works for me all of the times.				https://play.google.com/apps/publish?account=6499663341265583899#ReviewDetailsPlace:p=com.flyrobe.android&reviewid=gp:AOqpTOGPa9wtDHEMTygITTprNPnClrE-_zhStXGjrMKmJzDvisRP14KrfDFocXCyjcR7IhblQpDDmtkVquUc_A
com.flyrobe.android			en	MACHFIVE	2017-03-16T09:16:12Z	1489655772874	2017-03-16T09:16:12Z	1489655772874	5		My favorite pinnacle fashionable celebrities and style manufacturers transfer off too high-priced to buy are available so reasonably-priced go away her to lease you could use it each time you need to put on a				https://play.google.com/apps/publish?account=6499663341265583899#ReviewDetailsPlace:p=com.flyrobe.android&reviewid=gp:AOqpTOFYIJ9syhGfkiujREAE7slt_tdpakyrM-lwDWU_qgPdzqn9ZUpS9sF-34rLoFhLt3j3U236qtoCZIczjw
com.flyrobe.android			en	j2lte	2017-03-16T09:16:11Z	1489655771669	2017-03-16T09:16:14Z	1489655774737	5		Cool application cool services they've a awesome customer care provider will help you to find every proper product consistent with your alternatives amazingly properly to apply				https://play.google.com/apps/publish?account=6499663341265583899#ReviewDetailsPlace:p=com.flyrobe.android&reviewid=gp:AOqpTOEkHV5u1PlvCntvP43R2WtjKOoi--zbnqDsOEn-7lyQ5U7kOP-TFLOjUumv3IZ136cIvdGBRCAaSTpR_w
com.flyrobe.android	35	2.2.4	en	j2lte	2017-03-16T09:16:19Z	1489655779757	2017-03-16T09:16:27Z	1489655787344	5		large fan of the application they have quite a few remarkable selections to pick from I virtually ask you to try it				https://play.google.com/apps/publish?account=6499663341265583899#ReviewDetailsPlace:p=com.flyrobe.android&reviewid=gp:AOqpTOHr9ssDVSRI3hn_TE8AHq8UoJ0nDAX1plTLpoV_8oI3LfkvqkGxCuuPIobt16CzlbEWmcdIOUeG3UagUQ
com.flyrobe.android	35	2.2.4	en	htc_v36bml_dugl	2017-03-16T09:16:39Z	1489655799747	2017-03-16T09:16:47Z	1489655807546	5		Attensa range at a very honest fee they assist me to shop quite a few cash through capable of rent garments this is outstanding to apply				https://play.google.com/apps/publish?account=6499663341265583899#ReviewDetailsPlace:p=com.flyrobe.android&reviewid=gp:AOqpTOG3xNMr_fJARgIc3-h1p_ooqz6AhfJLvAoVD2Kw64mRHFg4-DFSzcPZ7F_5APyOVHNX5_KI1W4jvz5tdA
com.flyrobe.android	35	2.2.4	en	A89	2017-03-16T09:30:41Z	1489656641169	2017-03-16T09:30:55Z	1489656655865	5		utility for the people who do not have the time to choose from lots of merchandise to shop for instead they can hire it without problems from your				https://play.google.com/apps/publish?account=6499663341265583899#ReviewDetailsPlace:p=com.flyrobe.android&reviewid=gp:AOqpTOHsrELF3Jqc0z5t5ZmnnZkZ44arhf4kXazXYBXN-4P5ySsxK7_qHQqLs4J4orwiBdVXCghcnboKIlg0eg
com.flyrobe.android	35	2.2.4	en	grandprimevelte	2017-03-16T09:33:13Z	1489656793493	2017-03-16T09:35:24Z	1489656924064	5		Play offerings the client care is truly excellent and expertise and they are continuously including products again and again so it's far absolutely a laugh				https://play.google.com/apps/publish?account=6499663341265583899#ReviewDetailsPlace:p=com.flyrobe.android&reviewid=gp:AOqpTOGY-Iv9O4XfNtQhzf_kJE5bd7DoULHRbw_aCr3t0Nmz6whD8INZXoGCxRnQipjfLHHmms8cWFeD6zSgKw
com.flyrobe.android	35	2.2.4	en	LS-5016	2017-03-16T08:52:04Z	1489654324331	2017-03-16T09:47:49Z	1489657669238	5		Very productive utility rather than the use of programs Laguna koruko so i'd definitely pass for which i've this is remarkable to lease garments				https://play.google.com/apps/publish?account=6499663341265583899#ReviewDetailsPlace:p=com.flyrobe.android&reviewid=gp:AOqpTOFo1TRCsIHa0PMiNbZAEfdm9UoAGB45DuMof1re_oYEEHLYJiLRIzAhi7CPNzwrHN7hCMmvp5D1fz21yQ
com.flyrobe.android	35	2.2.4	en	msm8909	2017-03-16T10:00:44Z	1489658444403	2017-03-16T10:01:24Z	1489658484283	5		Hashmi to keep numerous cash this application is actually a laugh in terms of having all of the matters that you wanted one vicinity all of the accessories to be had for rent to				https://play.google.com/apps/publish?account=6499663341265583899#ReviewDetailsPlace:p=com.flyrobe.android&reviewid=gp:AOqpTOEmgMnN5uAxWOG_lyhy_kEj4Ty9n-5CcpQ2maqi9bJNyc8SK3_I7B6S1hRzYDGQs2YtzyOr9iiZUJ8KWQ
com.flyrobe.android	35	2.2.4	en	j2lte	2017-03-16T07:33:58Z	1489649638528	2017-03-16T10:04:24Z	1489658664028	5		tremendous application fantastic offerings i'm a big fan of this utility and it's miles sincerely top notch to have this software to your smartphone proper now nearby make it				https://play.google.com/apps/publish?account=6499663341265583899#ReviewDetailsPlace:p=com.flyrobe.android&reviewid=gp:AOqpTOHawZBJDZuNiE5VO58adQQN007zkMf-_RxEsb5Mer04I-t2nHBePgPsyts2V106sdEf_sy3Vtp8-k01jQ
com.flyrobe.android	35	2.2.4	en	YUPHORIA	2017-03-16T10:06:56Z	1489658816315	2017-03-16T10:07:07Z	1489658827872	5		added to the surrounding community there obviously doing that exceptional and i would totally encourage them to make this provider to be had anywhere in India				https://play.google.com/apps/publish?account=6499663341265583899#ReviewDetailsPlace:p=com.flyrobe.android&reviewid=gp:AOqpTOFZvMQNF-fLQFqFpypoAYl-4EKqu4Ch0aFsU_QeYXdIxoFNZePqQAcWfMKxJrGTnqDcdGBNV6-PwPPHPQ
