com.flyrobe.android			en	P55_Novo	2016-11-09T10:47:58Z	1478688478642	2016-11-09T10:47:58Z	1478688478642	5		This application renting cloth has been such a great thing buying close was a Nightmare for me because search many clothes are really a costly when you don't get to buy that offer this application help me out a lot				https://play.google.com/apps/publish?account=6499663341265583899#ReviewDetailsPlace:p=com.flyrobe.android&reviewid=gp:AOqpTOF3xTLVzAT6q7bL_eKUWMF7yXyaBpc59Z7t_VM3EY5xAPpWxjvjVniIu2vwEFGfG8IGxmS291Oeq4Q4ag
com.flyrobe.android			en	ms013g	2016-11-09T10:43:32Z	1478688212016	2016-11-09T10:48:09Z	1478688489224	5		Make that quite easy to rental services which are really good on the clothes and everything can be rented out so easily				https://play.google.com/apps/publish?account=6499663341265583899#ReviewDetailsPlace:p=com.flyrobe.android&reviewid=gp:AOqpTOErnPsd-vQAqkCIzz_oecpSJOdsH119C-A2wJh_xGpUAffswSN8fF2M3h_ystC5T0raonGNK6QYz-62Xg
com.flyrobe.android	31	2.2.0	en	vivalto5mve3g	2016-11-09T10:48:22Z	1478688502718	2016-11-09T10:48:22Z	1478688502718	5		I'm totally shocked and surprised that I am Sachin read application online and also recommended the sake navigate				https://play.google.com/apps/publish?account=6499663341265583899#ReviewDetailsPlace:p=com.flyrobe.android&reviewid=gp:AOqpTOHDyutq3xZc961KPzz3CPz4H95aIJA2Cf0ozCfF9vJxiv4c8uvsPxqMwUU5aGkjZFxUq5x09VqROh_vzg
com.flyrobe.android	31	2.2.0	en	fortuna3g	2016-11-09T10:49:21Z	1478688561775	2016-11-09T10:49:21Z	1478688561775	5		It applications online shopping services never complete without this rental application great for getting on the clothes 3 release				https://play.google.com/apps/publish?account=6499663341265583899#ReviewDetailsPlace:p=com.flyrobe.android&reviewid=gp:AOqpTOH_KzVtxVs8GQHPrUWIA3jdiX8bW_YLeVcFNOjYUQtKW9qbzsdMebZut9WXC8IYzK__3H-whdnIXE4qWQ
com.flyrobe.android			en	athene	2016-11-09T10:49:58Z	1478688598782	2016-11-09T10:49:58Z	1478688598782	5	Useful	I am happy that I found all the great clothes I totally recommend it to all my friends makes it so much better to use a totally like it this application has been my favourite since a long. of time you lie I am awake shopaholic and I love to you spend a lot of money on shopping this application help me to leave the same amount of money to rent great low thank you so much for a				https://play.google.com/apps/publish?account=6499663341265583899#ReviewDetailsPlace:p=com.flyrobe.android&reviewid=gp:AOqpTOHOOE4qPAriSi9PzbFEsZx9H-rThPJ_LQCEzDx7YYUGeyf2E6WZTv30Cm0BQn3flnxuIAhY9eyzVijUUQ
com.flyrobe.android	31	2.2.0	en	A7020a48	2016-11-09T10:50:30Z	1478688630070	2016-11-09T10:50:30Z	1478688630070	5	F	Send of India services if you don't have the appropriate loader can go for this application really good for rental services few lines quite in a good enough for all kinds of costly brands like mango and hnm you can definitely go for this application has a of a lot in saving money				https://play.google.com/apps/publish?account=6499663341265583899#ReviewDetailsPlace:p=com.flyrobe.android&reviewid=gp:AOqpTOEw3GkYObzfC0_Q_e35-XXS3Ur8siLAUIPnY9m07g8IZAtD5N5qYSx9guE-NAYjVIVlH3WJTUETfeaXcw
com.flyrobe.android			en	LS-4004	2016-11-09T10:52:01Z	1478688721446	2016-11-09T10:52:01Z	1478688721446	5		A lot of clothes from Milta like application but I have stopped on this application having only 19 clothes which is really great and awesome I totally love really good services				https://play.google.com/apps/publish?account=6499663341265583899#ReviewDetailsPlace:p=com.flyrobe.android&reviewid=gp:AOqpTOE9Ypo0oDgeS_JJHJ3a9ms_F3DySm1VUKRw_rUsNWozfmP-MWnM8z9729ZZVegCUcU3nf7PRQeZvX6G5Q
com.flyrobe.android	31	2.2.0	en	lux_uds	2016-11-09T10:52:09Z	1478688729992	2016-11-09T10:52:09Z	1478688729992	5		Account application without this application is so difficult for getting all the rental clothes online this one is definitely awesome inverted newlines big fan of getting on the clothes online this one helper the lord getting all the fashionable where at very cheap prices is available with this rental service best one for fashion food forward				https://play.google.com/apps/publish?account=6499663341265583899#ReviewDetailsPlace:p=com.flyrobe.android&reviewid=gp:AOqpTOGHJuKGCpeIJCGpXOT5pKEWIMDvllzsfcJmqQYt4zNt_q4Q_jPHK01fYMiM3RPZ8_6OIvaH4iNuLKckRA
com.flyrobe.android			en	S315	2016-11-09T10:52:39Z	1478688759989	2016-11-09T10:52:39Z	1478688759989	5		Applications that you can ever get a new phone right now I am happy that I found this application so soon				https://play.google.com/apps/publish?account=6499663341265583899#ReviewDetailsPlace:p=com.flyrobe.android&reviewid=gp:AOqpTOHpF9vv7br0_Ptax1yAREbYpEtk2Thetr1qTC2Wnn2Q8qkMk59M7Dh6lUSn9Dc2gtti5cUQiHKTG3akqQ
com.flyrobe.android	31	2.2.0	en	A6020a46	2016-11-09T10:50:31Z	1478688631156	2016-11-09T10:52:44Z	1478688764686	5		Good accessories which are going well with my entire collection of wardrobe without any trouble this application server whatever I want to easily				https://play.google.com/apps/publish?account=6499663341265583899#ReviewDetailsPlace:p=com.flyrobe.android&reviewid=gp:AOqpTOEDVCFsnOCOO39NdsVdwkuzUd80iw6bKbW3dSLu3k1rjzF3RmUflOeKo3rhkS66wGtJWhWnEpdNTlzVnw
com.flyrobe.android	31	2.2.0	en	D2212	2016-11-09T10:53:06Z	1478688786233	2016-11-09T10:53:06Z	1478688786233	5		One of the best applications ever for all kinds of inter-services you can definitely go for the SAP it is definitely awesome and fun to use				https://play.google.com/apps/publish?account=6499663341265583899#ReviewDetailsPlace:p=com.flyrobe.android&reviewid=gp:AOqpTOFyzsUQ_XVSbi0ybNiEaIubHyTWVSLiKSWAfoK_8uIFM-HmMJ-by4xnRJnyWYp0MQ9ikWtxSu93f3THNA
com.flyrobe.android	31	2.2.0	en	j5xnlte	2016-11-09T10:54:36Z	1478688876805	2016-11-09T10:54:36Z	1478688876805	5		See the customer Service I totally love the prom service they provide you much needed recommended service				https://play.google.com/apps/publish?account=6499663341265583899#ReviewDetailsPlace:p=com.flyrobe.android&reviewid=gp:AOqpTOH4KKQ0332qwH-D44HnCYZ3PhjYAqulk02AaoBQn7WAkpKFSlpJaW--efTNi_E95SQ6iNXP-9222IPRlg
com.flyrobe.android			en	s8_v41_jb3_w	2016-11-09T10:54:51Z	1478688891140	2016-11-09T10:54:51Z	1478688891140	5		Application there collection is really awesome I totally love using the application services again and again				https://play.google.com/apps/publish?account=6499663341265583899#ReviewDetailsPlace:p=com.flyrobe.android&reviewid=gp:AOqpTOFQbv64UdtNreJ1g7c5DzYyeuyfQovUsZoWwvT2IfaBBfVhSEeh6Z3E6O2HfUj-GjQzOgfEl9rMi-ewVw
com.flyrobe.android	31	2.2.0	en	K50a40	2016-11-09T10:55:15Z	1478688915862	2016-11-09T10:55:15Z	1478688915862	5		Seducing a really good I totally love it very cheap and you can totally virant rather than buying				https://play.google.com/apps/publish?account=6499663341265583899#ReviewDetailsPlace:p=com.flyrobe.android&reviewid=gp:AOqpTOGRtlSNHthrpf2NPGmmjjo19VNX_f9-Wt20zej9BhkiRn08RZ5paHZxjjGCploAS0E5C4zMRyM46I28Sw
com.flyrobe.android			en	j2lte	2016-11-09T10:55:31Z	1478688931731	2016-11-09T10:55:31Z	1478688931731	5		Wanted the collection for a quite long time this application is now available in my city and that is why I totally love it this application is way better than I expected this is a must have application on your phone right now you like to very appreciate the efforts we should definitely get it on your phone so awesome and good				https://play.google.com/apps/publish?account=6499663341265583899#ReviewDetailsPlace:p=com.flyrobe.android&reviewid=gp:AOqpTOGq0na6NcvVoyWcvRGAtINRq4GF1k3D9WZvVD3m1QkgpksnfXhEa3z6w0Zrs8TcQeLQwD2bR4KThuooBw
com.flyrobe.android	31	2.2.0	en	htc_a32ml_dtul	2016-11-09T11:01:11Z	1478689271505	2016-11-09T11:01:11Z	1478689271505	5		Application for renting services this application deserves a lot more than 5 stars				https://play.google.com/apps/publish?account=6499663341265583899#ReviewDetailsPlace:p=com.flyrobe.android&reviewid=gp:AOqpTOHyh4xtCp14YAGzrrq3-WRnkEzLFtzSXPESxaxS0teXyU-tGkxDbKJQ1JMPl9pBVOW5KEklDRYw-z0VQg
com.flyrobe.android	31	2.2.0	en	IrisFuelF1	2016-11-09T11:02:44Z	1478689364996	2016-11-09T11:02:44Z	1478689364996	5		Absolutely amazing up there is nothing that this application cannot do this is totally awesome for all kinds of Rental services total update				https://play.google.com/apps/publish?account=6499663341265583899#ReviewDetailsPlace:p=com.flyrobe.android&reviewid=gp:AOqpTOG1q08DWjYCJuMK_bk9gxVA3U9CIQb6NZgQFLDLsZXTqP28O_D4hSw8eT2_smt7xy7hmtaLlXGSP6_nRg
com.flyrobe.android	31	2.2.0	en	Q380	2016-11-09T11:04:38Z	1478689478494	2016-11-09T11:04:38Z	1478689478494	5		Best application for renting close online kinetics wisely help you out alot				https://play.google.com/apps/publish?account=6499663341265583899#ReviewDetailsPlace:p=com.flyrobe.android&reviewid=gp:AOqpTOFj4SoZl70pp5ZCRvmWuBvVKN02CH6XGFf4pOdBPa6iwpR_ZMfE91bNnG8_MIjLeVKEsbSTNJ9AyVr20Q
com.flyrobe.android	31	2.2.0	en	kenzo	2016-11-09T11:05:14Z	1478689514253	2016-11-09T11:05:14Z	1478689514253	5		Latest amazing to use for cloth of great quality and very hygiene call so you can definitely ask for the service				https://play.google.com/apps/publish?account=6499663341265583899#ReviewDetailsPlace:p=com.flyrobe.android&reviewid=gp:AOqpTOFkNNWKJrAJu6PtMFrEzChfRAtaBlg7n5FRRo6nryxFjoAqQkm-beyFp-aTbhKkH8KJhbeHbRVQper_NQ
com.flyrobe.android			en	j5lte	2016-11-09T11:05:15Z	1478689515684	2016-11-09T11:05:15Z	1478689515684	5						
com.flyrobe.android			en	P55_Novo	2016-11-09T11:06:11Z	1478689571263	2016-11-09T11:06:11Z	1478689571263	5		Sachin innovative Idea Internet of I totally love you say your application again and again good user interface and great concepts				https://play.google.com/apps/publish?account=6499663341265583899#ReviewDetailsPlace:p=com.flyrobe.android&reviewid=gp:AOqpTOF6d1O44hsG7qCNjrOcJTA0P95va2lqV0eyDCGFv9d-TqwJnV5fJRLvFut3YGrx6M0FQ48OjNzWIQYpZA
com.flyrobe.android			en	Coolpad8297L-I00	2016-11-09T11:12:59Z	1478689979197	2016-11-09T11:12:59Z	1478689979197	5		Makes it so much better to use I hate love printing cloth and thus application is definitely on my top of the list when I go when it goes to Fashion renting online				https://play.google.com/apps/publish?account=6499663341265583899#ReviewDetailsPlace:p=com.flyrobe.android&reviewid=gp:AOqpTOEV4fZTZfKJnOhVsBsYPgk3vjTDzICWllKEJ14W3Bd7ZWYpVo1MIAJrVQvNX74bejW9U59JxMsxUsMRIQ
com.flyrobe.android	31	2.2.0	en	titan_umtsds	2016-11-09T15:08:38Z	1478704118425	2016-11-09T15:08:38Z	1478704118425	2		Hey flyrobe..i wanted to ask that its written rent ₹ abc. So does dt mean its for rent ? Or it will belong to us only afyer dat?				https://play.google.com/apps/publish?account=6499663341265583899#ReviewDetailsPlace:p=com.flyrobe.android&reviewid=gp:AOqpTOHm5w9RpQO1MV0tfMl2X_xhJK4Yr5M5rEOXnr0rPdpNuuiCKl3pyyTcpL_TmmG8xRjDdjFsA2Qub9tVEQ
com.flyrobe.android			en	OnePlus	2016-11-10T06:33:15Z	1478759595612	2016-11-10T06:33:15Z	1478759595612	4						
com.flyrobe.android			en	kenzo	2016-11-10T13:09:40Z	1478783380868	2016-11-10T13:09:40Z	1478783380868	5		Rental services are way better than buying clothes flyrobe helps me to get all the clothes that I want is easily				https://play.google.com/apps/publish?account=6499663341265583899#ReviewDetailsPlace:p=com.flyrobe.android&reviewid=gp:AOqpTOGc9JbFHqHpqn3H2X8H-Hi8R53_ulnUHK5hbdbkhWFt99YtLhhs6EDKamlQvaRezhv23LOmdE7Qu4G6_A
com.flyrobe.android			en	taido_row	2016-11-10T13:16:05Z	1478783765969	2016-11-10T13:16:05Z	1478783765969	5		Best application online shopping has been so much fun with this one I totally love using this one for women shopping purposes				https://play.google.com/apps/publish?account=6499663341265583899#ReviewDetailsPlace:p=com.flyrobe.android&reviewid=gp:AOqpTOHhkdFt8rVwd7Q6y8an9gUYGHAxIRQzac__KT7y4oJnnJpjCo1uLiMf2bR6gKs6iX6aprUoaalBbGfx-w
com.flyrobe.android	31	2.2.0	en	core33g	2016-11-08T09:40:36Z	1478598036635	2016-11-10T13:19:41Z	1478783981520	5		Absolutely one of the best applications this one has a lot of great things in at renting everything is so easy with this application				https://play.google.com/apps/publish?account=6499663341265583899#ReviewDetailsPlace:p=com.flyrobe.android&reviewid=gp:AOqpTOHYCRIS77zGqiC8W-Y36j0aTLY-xhrNUv-cqHBLO8otCiD1k2eBSAiKb_6MozUBlW1RWokV3gUs_CsnSA
com.flyrobe.android	31	2.2.0	en	E5363	2016-11-10T13:20:23Z	1478784023363	2016-11-10T13:20:23Z	1478784023363	5	Good	Amazing application rental services are really cool you get to rent every great brand at very cheap prices				https://play.google.com/apps/publish?account=6499663341265583899#ReviewDetailsPlace:p=com.flyrobe.android&reviewid=gp:AOqpTOHSD_5rvddd-iCgajyd7ThzaFCUNycGKEpEohIxVENFViY3OlKFX7b8xmajoqmWk_NkTItBagWQS-FAKw
com.flyrobe.android	31	2.2.0	en	kenzo	2016-11-10T13:22:16Z	1478784136775	2016-11-10T13:22:16Z	1478784136775	5	Nyc	School application with lots of great uses you will be also amazed at how good it is this is one good application for renting clothes online				https://play.google.com/apps/publish?account=6499663341265583899#ReviewDetailsPlace:p=com.flyrobe.android&reviewid=gp:AOqpTOH8GISTtDWGehstE_cxHNqfsZUySDMRw8ufSm8FEExEwSUn6_YJFdo8KXYwR-2PMjtl_g1Kwc4YCfGe4A
com.flyrobe.android	31	2.2.0	en	grandprimevelte	2016-11-10T13:23:34Z	1478784214875	2016-11-10T13:23:34Z	1478784214875	5		They have amazingly good rental clothes and services online you will be amazed at how god there application is really fun to use				https://play.google.com/apps/publish?account=6499663341265583899#ReviewDetailsPlace:p=com.flyrobe.android&reviewid=gp:AOqpTOFnsbjBkBpuOBc_yWA5-5wjrKtGeE8_yxtmgR9oUOVQbYlecPJIRnRMGdZdqsPsrem157kyRO-QVVVHbA
com.flyrobe.android	31	2.2.0	en	A1601	2016-11-10T13:24:56Z	1478784296794	2016-11-10T13:24:56Z	1478784296794	5		Great to use application it has made shopping so much simple I love shopping from this application best place to rent clothes online				https://play.google.com/apps/publish?account=6499663341265583899#ReviewDetailsPlace:p=com.flyrobe.android&reviewid=gp:AOqpTOF0TFLaeHWboXv0bkfqFyZEFHlMcC6QyfXhN320rcDQT5xDdP2oO3hHehzgO_aMIUK4pF0h-sydtQxx-g
com.flyrobe.android	31	2.2.0	en	land	2016-11-10T13:24:32Z	1478784272442	2016-11-10T13:25:04Z	1478784304750	5		This application is totally awesome you would absolutely use that instead of roposo like application this is really fun				https://play.google.com/apps/publish?account=6499663341265583899#ReviewDetailsPlace:p=com.flyrobe.android&reviewid=gp:AOqpTOEgrkK9W5NNDidYbnIdFejYcWPS0g4VvKLuVuHeFqqvk0j7GNbbEu3uYxix3J-APZ-04wsCRwGcD-Wj_A
com.flyrobe.android			en	MACHFIVE	2016-11-10T13:25:27Z	1478784327077	2016-11-10T13:25:27Z	1478784327077	5		Women shopping has been so much easy with this one I totally love it this application provides me with whatever I want at one place				https://play.google.com/apps/publish?account=6499663341265583899#ReviewDetailsPlace:p=com.flyrobe.android&reviewid=gp:AOqpTOHH-g992qkYkRdK2oqvvrVM6zVGzIFGOxOVrCCh_xWYXWw8GSYs6TIZ1ZXXuzVM2jty35P_Pttv7kcqwg
com.flyrobe.android			en	baffinlite	2016-11-10T13:27:08Z	1478784428310	2016-11-10T13:27:08Z	1478784428310	5		Simple and easy this one has a lot of great services at one place I totally agree with how good it is				https://play.google.com/apps/publish?account=6499663341265583899#ReviewDetailsPlace:p=com.flyrobe.android&reviewid=gp:AOqpTOHPZaqM_EhU15WlhgZodJah6rHRYoysgle03_nRoCoAYaFE-8XJUGIITnl5ah6mlMwr8wGzu_q_WyjHsw
com.flyrobe.android	31	2.2.0	en	X3_HK	2016-11-10T13:27:48Z	1478784468770	2016-11-10T13:27:48Z	1478784468770	5		Amazingly good very quick services that deliver on time I love to use this application for all the create close that it has to order				https://play.google.com/apps/publish?account=6499663341265583899#ReviewDetailsPlace:p=com.flyrobe.android&reviewid=gp:AOqpTOF81Q3rrm5r6bUHXfK5pC-oaDHkRiDtiheNviJncYcC_0Kux3fRWr_x1LiDDcEfIrYS3KqDl0xK2wkWUw
com.flyrobe.android	31	2.2.0	en	core33g	2016-11-10T13:27:35Z	1478784455360	2016-11-10T13:27:50Z	1478784470944	5		Amazing application amazing services it is very delightful to use this one for all kinds of clothing shopping purposes				https://play.google.com/apps/publish?account=6499663341265583899#ReviewDetailsPlace:p=com.flyrobe.android&reviewid=gp:AOqpTOH5UeD9fypMt0qnu3gMWtZgKAauoToLSxYJc8T_uhyJn9Yer6qJwbif2EmBZ9h-Jci6yGcLyDNBZMSwNQ
com.flyrobe.android	31	2.2.0	en	GIONEE	2016-11-10T13:27:52Z	1478784472336	2016-11-10T13:27:52Z	1478784472336	5		So many Deals And discounts this application is really wonderful when it comes to clothing services rental services were really cheap				https://play.google.com/apps/publish?account=6499663341265583899#ReviewDetailsPlace:p=com.flyrobe.android&reviewid=gp:AOqpTOHjbK6MsRQohh-U2iCQCH4cDUxKFdSqVgSATtPklSVibipEgKMt-DYr9IO_55XSvqhdv8SftXzt-ScMVA
com.flyrobe.android	31	2.2.0	en	CP8298_I00	2016-11-10T13:29:04Z	1478784544493	2016-11-10T13:29:04Z	1478784544493	5		Open application of some users I have been using flyrobe for all the rental purposes of mine it help me to get everything so quickly and easily				https://play.google.com/apps/publish?account=6499663341265583899#ReviewDetailsPlace:p=com.flyrobe.android&reviewid=gp:AOqpTOEmjtbqXv5KoFUP5yaCSMJ36D7i9O8CGTy1tstUXNAs-HZEmQ7O7RSJwCbwfMtnjrP6KGMiIBNH0-zRLQ
com.flyrobe.android	31	2.2.0	en	htc_a50cml_dtul	2016-11-10T13:29:54Z	1478784594911	2016-11-10T13:29:54Z	1478784594911	5		Simply the best deals of adhere all the rental clothes of great quality and you can absolutely trust them very trustworthy application				https://play.google.com/apps/publish?account=6499663341265583899#ReviewDetailsPlace:p=com.flyrobe.android&reviewid=gp:AOqpTOFgvEnfVW5uBQqSQ3Ui0X_9g60EvA9t1RlDYKoF6GUc4dcuOCe-CSUQ4CGnPaipGRaaTh4OwoC3PLpy9w
com.flyrobe.android			en	A82	2016-11-10T13:29:35Z	1478784575879	2016-11-10T13:30:40Z	1478784640583	5		Review				https://play.google.com/apps/publish?account=6499663341265583899#ReviewDetailsPlace:p=com.flyrobe.android&reviewid=gp:AOqpTOGXdbTxpLYu5DRY4lNaTtDxAklvzrN06UjaPN4NznwQKKYaIHUsLLCNmtCRowrghxvJGZ4xKd2J3Lh2bg
com.flyrobe.android	31	2.2.0	en	titan_umtsds	2016-11-10T13:33:06Z	1478784786142	2016-11-10T13:33:06Z	1478784786142	5		College application I totally love it this has been one of the best experiences ever for getting everything online so easily				https://play.google.com/apps/publish?account=6499663341265583899#ReviewDetailsPlace:p=com.flyrobe.android&reviewid=gp:AOqpTOGqjViGMR5tTu3z7S_37stWq3nK9mQ4X-QSD4f8Nx-aGz-ucAx5bWGI8bW06Vq53np6pdQKslBEOr8EhQ
com.flyrobe.android	31	2.2.0	en	Y51L	2016-11-10T13:33:58Z	1478784838820	2016-11-10T13:33:58Z	1478784838820	5		Flyrobe provides he with fashion on the go there they have so many good rental services this is so much better than applications like roposo				https://play.google.com/apps/publish?account=6499663341265583899#ReviewDetailsPlace:p=com.flyrobe.android&reviewid=gp:AOqpTOGw2_T_e1kiaDEQZ9PcRiAYEw-yFuFNbSutaR5Jm7Kqn3fSWcCcwVGPq5ZpoBHJX6ZQtX2jWBOIzFByMw
com.flyrobe.android	31	2.2.0	en	P1ma40	2016-11-10T13:34:17Z	1478784857891	2016-11-10T13:34:17Z	1478784857891	5		The best application you can get fashion on the go this one provides you with all the great shopping services and deals at one place				https://play.google.com/apps/publish?account=6499663341265583899#ReviewDetailsPlace:p=com.flyrobe.android&reviewid=gp:AOqpTOFtw_FB7aqUhr5_34Mmeg03H0wGeqkzWpaJwzzq8WvYix6EWfYeaKlfVm2ho1h5-vUD2FRpXTl8_dzZ_w
com.flyrobe.android			en	CP8676_I02	2016-11-10T13:34:27Z	1478784867570	2016-11-10T13:34:27Z	1478784867570	5		Amazing Deals And discount I totally love it this application is really great for online shopping purposes and deals				https://play.google.com/apps/publish?account=6499663341265583899#ReviewDetailsPlace:p=com.flyrobe.android&reviewid=gp:AOqpTOE-_HWv1dTWknDRE9NATAC5XD4Z2fF2AoMeAulxPnuUysXNSE9DpElG0c0NYbmPDS2IioJf5nENkhTU8w
com.flyrobe.android	31	2.2.0	en	C6902	2016-11-10T13:34:52Z	1478784892681	2016-11-10T13:34:52Z	1478784892681	5		Application for all the people who would love to go for online shopping this one helped you out a lot to get great clothes at cheap prices				https://play.google.com/apps/publish?account=6499663341265583899#ReviewDetailsPlace:p=com.flyrobe.android&reviewid=gp:AOqpTOEOlj_TAlP7CnWw-7EDItKteZBS4nBE0KarIS49CnnRgv0mwmQ4pYCCnGUSZ5iS_TEE86rHGJitFMR_4g
com.flyrobe.android			en	GIONEE_GBL7360	2016-11-10T13:34:56Z	1478784896124	2016-11-10T13:34:56Z	1478784896124	5		Great site and collection of clothes in services that I cannot find anywhere else this application provides me with lot of great things at one place				https://play.google.com/apps/publish?account=6499663341265583899#ReviewDetailsPlace:p=com.flyrobe.android&reviewid=gp:AOqpTOFDcRZ2fLdFQgfnV1RMaGTpthGlSFr9vlG7bSCYlYVT2rn-_b97VHCfiAB4haDuH3XgmFtGPFipDp6ITA
com.flyrobe.android	31	2.2.0	en	A6020a40	2016-11-10T13:35:50Z	1478784950093	2016-11-10T13:35:50Z	1478784950093	5		Cheap prices you can get so many good clothes on rental basis this application is really good for all the people who would love to go online shopping				https://play.google.com/apps/publish?account=6499663341265583899#ReviewDetailsPlace:p=com.flyrobe.android&reviewid=gp:AOqpTOFIVtb0lxNZ_qgaJAOg4oKl6Qu6zL7x41ame4Pa0ORAELgYvLHRKcJHwNVZDoJ0jlWuwoeU9b74d8zMyg
com.flyrobe.android	31	2.2.0	en	kenzo	2016-11-08T09:40:38Z	1478598038027	2016-11-10T13:37:20Z	1478785040006	5		This is quite cool one of the best application for online shopping rental services are really good				https://play.google.com/apps/publish?account=6499663341265583899#ReviewDetailsPlace:p=com.flyrobe.android&reviewid=gp:AOqpTOEOSyVU-Cs_lzX-bW1M52HFm7ahLKdlTVwkVydyp_bHff453XCDgk6ul8ywU2DoOPmG-iCEU81wuCPDCg
com.flyrobe.android	31	2.2.0	en	j2lte	2016-11-10T13:36:49Z	1478785009165	2016-11-10T13:38:33Z	1478785113092	5		Absolutely love to use this one they have so many great product that I cannot find anywhere else really awesome and fun to use				https://play.google.com/apps/publish?account=6499663341265583899#ReviewDetailsPlace:p=com.flyrobe.android&reviewid=gp:AOqpTOENWfPQdL_JD3bB9kuiqOS1Q6Qf9stV5On3VAw8G_czsrbi-jNlDpNWzE5BQNjdqoBTBWVDAhzvr7Vlsw
com.flyrobe.android	31	2.2.0	en	grandneove3g	2016-11-10T13:38:52Z	1478785132376	2016-11-10T13:38:52Z	1478785132376	5		Cool application lot of great amazing discounts and deals are going on in this application from time to time that is why I have absolutely love this application for rental online shopping				https://play.google.com/apps/publish?account=6499663341265583899#ReviewDetailsPlace:p=com.flyrobe.android&reviewid=gp:AOqpTOGm84IE4LJOMUKmp19skEkWuQlduntENdXaNkcOZDb5rQS7PC1-5IKz8WHvRGRt-rLraE2fC1eus1eIvg
com.flyrobe.android	31	2.2.0	en	Kraft-A6000	2016-11-10T13:39:05Z	1478785145139	2016-11-10T13:39:05Z	1478785145139	5		You get lots of as many as good things as this one for rental services this is absolutely cool and awesome				https://play.google.com/apps/publish?account=6499663341265583899#ReviewDetailsPlace:p=com.flyrobe.android&reviewid=gp:AOqpTOHa5UAAd1-Ch0uJErnBt0QA-j1GvpPNx5-EXpJBaT4wDnxzvsMmpfbHHIU2PNkn96zX3eiAsPC3DGokwQ
com.flyrobe.android	31	2.2.0	en	A33	2016-11-10T13:38:32Z	1478785112656	2016-11-10T13:39:11Z	1478785151206	5		Makes it amazingly simple and easy to use this application they have a vast and good collection of great clothes and everything on line				https://play.google.com/apps/publish?account=6499663341265583899#ReviewDetailsPlace:p=com.flyrobe.android&reviewid=gp:AOqpTOH-HRINZ10HoK0_ADhNrSarOqEXXoFTV-QH1MiDkwyQSMJ_Bzt-RYkavA6K2WZR4AKDaMRWmieeftCwNA
com.flyrobe.android	31	2.2.0	en	YUPHORIA	2016-11-10T13:39:38Z	1478785178706	2016-11-10T13:39:38Z	1478785178706	5		So many choices this application provide me with lot of great clothes that I cannot find anywhere else this is the best place for online shopping				https://play.google.com/apps/publish?account=6499663341265583899#ReviewDetailsPlace:p=com.flyrobe.android&reviewid=gp:AOqpTOFwxojsXuyy1sqibwIG1mAEBFdiyAaVpgKvkbeajfyBStt6OdvUuPVveUszI8GT5UrhXngJ-VhcrbfexA
com.flyrobe.android			en	ZL2	2016-11-10T13:40:17Z	1478785217236	2016-11-10T13:40:17Z	1478785217236	5	Awesome application lot of great products I totally love it they have a wide range of products to offer from	Awesome application lot of great products I totally love it they have a wide range of products to offer from				https://play.google.com/apps/publish?account=6499663341265583899#ReviewDetailsPlace:p=com.flyrobe.android&reviewid=gp:AOqpTOGYUhNQ-H2PUL57GAzEO8L1q9PDqnaI8bsprnQtxXIhxwlmZhLzkpUdyM9VXdTCedwq69ifJd5KFeQWzg
com.flyrobe.android	31	2.2.0	en	Q465	2016-11-10T13:39:25Z	1478785165767	2016-11-10T14:14:48Z	1478787288063	5		this application I have been using this one for quite a lot of time absolutely one of the fun app for shopping				https://play.google.com/apps/publish?account=6499663341265583899#ReviewDetailsPlace:p=com.flyrobe.android&reviewid=gp:AOqpTOGIXRM2JjHTFXJLN-GpSf3mQ60DplQCzPpgGqAKYeRtH3rdgrE8g6-C-sqYTIWijMEWeb2eZwD0uCxBag
com.flyrobe.android			en	htc_v02_dug	2016-10-17T07:50:31Z	1476690631909	2016-11-11T09:25:47Z	1478856347724	5	Good apps	Get an amazing application keeps me entertained about all the clothes I need to buy an even military trial with that is really amazing				https://play.google.com/apps/publish?account=6499663341265583899#ReviewDetailsPlace:p=com.flyrobe.android&reviewid=gp:AOqpTOGBQ8HMR89Xddx1eMrKXSIXlIxB-6PwlzhnAj14xSaQAQUbWiVwSwLE35ES2o5Y4J6Y09sCpTlOa2APtw
com.flyrobe.android			en	OnePlus2	2016-11-11T09:28:47Z	1478856527189	2016-11-11T09:28:47Z	1478856527189	5		This is my ideal application for all the rental process services in standard house add				https://play.google.com/apps/publish?account=6499663341265583899#ReviewDetailsPlace:p=com.flyrobe.android&reviewid=gp:AOqpTOFv91kd_XlUrbpb657iy2z8wKFHf4QyKojP428q01MPpH7KMlFE1WShRo3JBkprKnevumRnaqrZncx1Sg
