com.flyrobe.android	31	2.2.0	en	Y51L	2016-11-18T13:37:48Z	1479476268078	2016-11-18T13:42:00Z	1479476520022	5		amazing app for renting clothes online . great collection of clothes and also good customer service .				https://play.google.com/apps/publish?account=6499663341265583899#ReviewDetailsPlace:p=com.flyrobe.android&reviewid=gp:AOqpTOHtg_4Zn-VVolOJJweFSGuOfdxOBD1NuQDq078r8_LII-zDWwgXJ2RaaAcrQk-VFjdtzqVPkgT47Igtvg
com.flyrobe.android	31	2.2.0	en	iris405+	2016-11-18T13:42:12Z	1479476532027	2016-11-18T13:42:12Z	1479476532027	5		Very happy that I found application this was the condition of a friend and I thank my friend everyday for giving me such a great application				https://play.google.com/apps/publish?account=6499663341265583899#ReviewDetailsPlace:p=com.flyrobe.android&reviewid=gp:AOqpTOF2jyMjouRATgjt4gCRVpED5Q0Y9MFf2WLfbBM-BlP_DmK6aaZWMTsJBrFhhzWCoFgFWGVSrZuNRk1T6A
com.flyrobe.android	31	2.2.0	en	core33g	2016-11-18T13:44:39Z	1479476679856	2016-11-18T13:44:39Z	1479476679856	5		Flyrobes ! Amazing app with amazing quality of clothes . What else does a shopaholic need? when we can rent clothes which are worn by celebrities . nd also you get the opportunity to wear . Great app !				https://play.google.com/apps/publish?account=6499663341265583899#ReviewDetailsPlace:p=com.flyrobe.android&reviewid=gp:AOqpTOHa_T8ojOJCKu9Q8uV3Z_WXvSh6776ozn2kfbUzGG7zOAhQTQU7Bpqm32HryCAc-5fR9YtGbZNmj2ReTA
com.flyrobe.android	31	2.2.0	en	A69	2016-11-18T13:45:23Z	1479476723268	2016-11-18T13:45:23Z	1479476723268	5		all the women out there , flyrobes is an amazing app for women shopping .				https://play.google.com/apps/publish?account=6499663341265583899#ReviewDetailsPlace:p=com.flyrobe.android&reviewid=gp:AOqpTOGMN4lEmKdqb6X3NKYPzMGXMP9qNInal6LAYoCnDbhDxfxNEsB1F70sjZur9byb4JT3_UxXiHtsf-OB7w
com.flyrobe.android	31	2.2.0	en	LS-5010	2016-11-18T13:45:57Z	1479476757467	2016-11-18T13:46:47Z	1479476807364	5		many other apps like koovs and voonik have disappointed me and provided very bad quality of clothes everytime i ordered clothes . Flyrobes is a nice app that rent clothes with good quality as well ! nice app .				https://play.google.com/apps/publish?account=6499663341265583899#ReviewDetailsPlace:p=com.flyrobe.android&reviewid=gp:AOqpTOHADecQXxsW4sRZQXhMlrzB5veKS1kBPlWNQuxQt7PsG9rBxAW1tUb5CYsg1svK1nrH4dnw87Vl8oaqvw
com.flyrobe.android			en	htc_a50cml_dtul	2016-11-18T13:58:07Z	1479477487962	2016-11-18T13:58:08Z	1479477488082	4						
com.flyrobe.android	31	2.2.0	en	OnePlus2	2016-04-13T15:00:52Z	1460559652406	2016-11-19T08:56:12Z	1479545772010	1	Mismanagement at its peak	I dont know why i did not give a negative review the first time i ordered. Probably that was because i thought things would be better the next time. But no! I have had a horrible experience with flyrobe, not once but consecutively for the fourth time! EarlierAfter a lot of hassle i used to get a dress at the doorstep atleast. But this time you went a step further in proving how mismanaged the whole staff and logistics at your place is. Never ever going to order and waste my time on this useless app/website!				https://play.google.com/apps/publish?account=6499663341265583899#ReviewDetailsPlace:p=com.flyrobe.android&reviewid=gp:AOqpTOG5SjBao2GMqwDEUm-GNl3eI46wJdZvzg7683ppPVlIpmbloYbb3gA_CnvbixfISQZjau7BSugkcl7cFg
com.flyrobe.android	31	2.2.0	en	AQ4502_sprout	2016-11-19T09:18:33Z	1479547113534	2016-11-19T09:18:33Z	1479547113534	5		I had to attend a party in my office but I had no time to shop so my friend suggested me to try the flyrobes app which rents clothes of various brands for like 4 to 8 days . Great app !				https://play.google.com/apps/publish?account=6499663341265583899#ReviewDetailsPlace:p=com.flyrobe.android&reviewid=gp:AOqpTOFYo_WOXXiu_pG1ojscKHtu-_N3ZoBNcHcXu3hO6qC7sASOZ3Y5obePxXrWarRzKitT0OHVab8RW2ZNew
com.flyrobe.android	31	2.2.0	en	arubaslim	2016-11-19T09:30:22Z	1479547822472	2016-11-19T09:30:22Z	1479547822472	4	Fashion style	It is a nice shopping app				https://play.google.com/apps/publish?account=6499663341265583899#ReviewDetailsPlace:p=com.flyrobe.android&reviewid=gp:AOqpTOGugT0NMzh8iRe0TQ320-I7owviscCMtGu9awbcacZEtw4dnNkOdqEVS99pkLVQgYuq1pRXl9nPAI88PA
com.flyrobe.android	31	2.2.0	en	E455	2016-11-19T09:33:40Z	1479548020488	2016-11-19T09:33:48Z	1479548028048	5		Flyrobes is the best women shopping app . The best part is you dont have to buy the clothes , you just have to rent them at such reasonable prices . You just need to order the dress online and keep it for 4-8 days and flaunt the look :) and the dress would be picked up from the address at your convenient time				https://play.google.com/apps/publish?account=6499663341265583899#ReviewDetailsPlace:p=com.flyrobe.android&reviewid=gp:AOqpTOGETwbuwSIEFrq1I88_4AU07o_GmzH9Wa76goaw-UKv28306bpAds85YAEUJsuayayvAIgieqPqwfiDgw
com.flyrobe.android	31	2.2.0	en	kanas	2016-11-19T09:34:41Z	1479548081832	2016-11-19T09:34:41Z	1479548081832	5		I have tried many online shopping sites like roposo , voonik , koovs but some or the other way they did not please me and I had to return the clothes . I was just browsing through facebook and came across this app caled flyrobes , I loved the idea of renting clothes as buying designer outfits is way too expensive , and they providing such outfits on rent made me rent an outfit . It was really amazing to rent clothes from flyrobes .				https://play.google.com/apps/publish?account=6499663341265583899#ReviewDetailsPlace:p=com.flyrobe.android&reviewid=gp:AOqpTOEt-8rcVHYiFdczgo1VM3wOPf19a0qyZsmdO3y5JQtD9t0iiqBV76gD8Rp7RwtgYOBOR9XLBJS2YN0gIw
com.flyrobe.android			en	taido_row	2016-11-19T09:41:32Z	1479548492976	2016-11-19T09:41:32Z	1479548492976	5		My friend was in urgent need of clothes as she wanted to attend a party in her office . She could not find any from voonik and was disappointed . So I told her about the flyrobes app and she started checking clothes on the app , the minute she knew that she could rent the designer outfits she immediately rented one and the dress was very pretty .				https://play.google.com/apps/publish?account=6499663341265583899#ReviewDetailsPlace:p=com.flyrobe.android&reviewid=gp:AOqpTOFgGKSdQ83OiRFIpyvwPkq5pirXJ8jI0hU7udDupYfsaKcPNHfMJrCOlKwJm_2RQPoATZP-Rv5FtpF-yg
com.flyrobe.android			en	ASUS_Z00L_63	2016-11-19T09:42:50Z	1479548570056	2016-11-19T09:43:05Z	1479548585108	5	Wow...	Nice app...!				https://play.google.com/apps/publish?account=6499663341265583899#ReviewDetailsPlace:p=com.flyrobe.android&reviewid=gp:AOqpTOHR7804Q3WH4PcoS_lQYnLzV2YfXMJaG1XKWD4-OjEDQH3QLNlHyI1wBzQx6rjVgtPz5zQ1hpj_TIxsGw
com.flyrobe.android	31	2.2.0	en	P55	2016-11-19T09:47:22Z	1479548842434	2016-11-19T09:47:22Z	1479548842434	5		The most amazing application that I have used in the recent times for 11:10 closed on it is really so much better				https://play.google.com/apps/publish?account=6499663341265583899#ReviewDetailsPlace:p=com.flyrobe.android&reviewid=gp:AOqpTOH5ags4RaBOP0pwD0usd8vG9S3dhjT6irJV29kuR99YHaQa_X3ZpzFUHDrIzYJSIUKFdCUmDZE2awb8JA
com.flyrobe.android	31	2.2.0	en	Q380	2016-11-19T09:49:40Z	1479548980528	2016-11-19T09:49:40Z	1479548980528	5		Hannah's				https://play.google.com/apps/publish?account=6499663341265583899#ReviewDetailsPlace:p=com.flyrobe.android&reviewid=gp:AOqpTOE1UwRVZS8Ny834nwIiBXoG-Ljdjbo0nC-B1HMG3bZ0W2zKjQaaVQ0s62HZbzmUvptZi1GpIKGCWHVvnQ
com.flyrobe.android	31	2.2.0	en	kenzo	2016-11-19T09:49:47Z	1479548987546	2016-11-19T09:49:48Z	1479548988854	5		I always shop from this app all the occasions and parties . This app never leaves me disappointed . Prefer shopping from this app more than koovs and other sites .				https://play.google.com/apps/publish?account=6499663341265583899#ReviewDetailsPlace:p=com.flyrobe.android&reviewid=gp:AOqpTOFHSf5RgwXsu_hK1Ew1xQZMnMgjXd15K63xrtMeZHnnP18VfJ74HgODU40vuBdepMDEyCPHTvgARAeI0A
com.flyrobe.android			en	land	2016-11-19T09:50:21Z	1479549021045	2016-11-19T09:50:21Z	1479549021045	5		The huge collection and wide variety of clothing and different kinds of products on rent , this online shopping app has something very difficult to find in koovs and voonik! They are just amazing and excellent ! Good app !				https://play.google.com/apps/publish?account=6499663341265583899#ReviewDetailsPlace:p=com.flyrobe.android&reviewid=gp:AOqpTOFzwjvWW5O5DGkfizqzFH7c7N8bSNIjgT6UgPOEMO1s3LFMbx3vjdyCOdMBg04d-RakGSoSKXIyFwG_NA
com.flyrobe.android	31	2.2.0	en	fortuna3g	2016-11-19T09:51:10Z	1479549070244	2016-11-19T09:51:10Z	1479549070244	5		Flyrobes provide such good collection of clothes for both men and women who are brand lovers with such reasonable prices that every individual can rent clothes . Great app I must say !				https://play.google.com/apps/publish?account=6499663341265583899#ReviewDetailsPlace:p=com.flyrobe.android&reviewid=gp:AOqpTOE0ti3lmTStkBf8RFC2sIIyZ11-16m3r64KHv23cpDTKnBiCp3vwXdatq9fS9GSZoyBA6EtKbjSJayu8Q
com.flyrobe.android	31	2.2.0	en	D2502	2016-11-19T09:57:34Z	1479549454487	2016-11-19T09:57:34Z	1479549454487	5		Excellent quality of clothes available on this app! Would recommend it to all as it is the best for renting clothes				https://play.google.com/apps/publish?account=6499663341265583899#ReviewDetailsPlace:p=com.flyrobe.android&reviewid=gp:AOqpTOHBQCmujaxibvlxmniyOLMUKLt5CuN7scVPIUb_G6Les583WYUHDnq6XARWnp6xxJcuBrgfXiHWaf3svg
com.flyrobe.android	31	2.2.0	en	HWY541-U	2016-10-12T15:13:42Z	1476285222345	2016-11-19T09:58:07Z	1479549487066	5	N	Great app Flyrobes for women shopping! Really loved the app .	2016-10-14T13:06:34Z	1476450394430	Hi Ankita, Thank you so much for a awesome review. Hope to see you Flyrobe again. Love, Team Flyrobe.	https://play.google.com/apps/publish?account=6499663341265583899#ReviewDetailsPlace:p=com.flyrobe.android&reviewid=gp:AOqpTOFisfcQthK7LhkpXaM-ab4bzdBu_O_3TbUHFBOfSS3O3ZyUH3jVoVQieQek29kfQyHRjcsoL1DJnzw3Tw
com.flyrobe.android	31	2.2.0	en	j7elte	2016-11-19T09:58:21Z	1479549501129	2016-11-19T09:58:21Z	1479549501129	5		All the designer lovers , You have to check the flyrobes app and rent the clothes which are affordable . Good app!				https://play.google.com/apps/publish?account=6499663341265583899#ReviewDetailsPlace:p=com.flyrobe.android&reviewid=gp:AOqpTOFpkp2CjD21YFaspkf2HQz2KT2ODORvlmHjlwQqV0UCqi6IIzdT_xzIXv87xgy3vIihMEx83j1qct_ffA
com.flyrobe.android	31	2.2.0	en	era1X	2016-11-13T09:40:51Z	1479030051012	2016-11-19T10:01:44Z	1479549704424	5		Now you can rent clothes at the comfort of your home rather than wasting hours at the market! So Just download this app and start enjoying the benefits . The best app to shop for women and men !				https://play.google.com/apps/publish?account=6499663341265583899#ReviewDetailsPlace:p=com.flyrobe.android&reviewid=gp:AOqpTOEnE2LlLnK5FGV9_pOXRJFK2UYyot5ViEzwKTsCTZHlDhozNeflfsY_5VjMmXAf_Pn3cnyeQO3OhDMeEw
com.flyrobe.android			en	j7elte	2016-11-08T09:39:36Z	1478597976471	2016-11-19T10:03:18Z	1479549798977	5		I had suggested my friend about flyrobes and she rented a dress from it . I had referred flyrobes to her so I received a coupon of 600 and she could avail a dress for free of Rs600 . Great app !				https://play.google.com/apps/publish?account=6499663341265583899#ReviewDetailsPlace:p=com.flyrobe.android&reviewid=gp:AOqpTOE6WiVd-nWqFVVy00xe6BhjEU5V5sRJwGwwvydwuPnKCh4bWFy-h6uCRN7odos08h-rvRwDjBr1jlIFhw
com.flyrobe.android	31	2.2.0	en	le_s2_ww	2016-11-19T10:04:16Z	1479549856470	2016-11-19T10:04:16Z	1479549856470	5		My experience with Flyrobes was great ! Great quality clothes , fast delivery and awesome collection . Good app for renting clothes!				https://play.google.com/apps/publish?account=6499663341265583899#ReviewDetailsPlace:p=com.flyrobe.android&reviewid=gp:AOqpTOGzkw2ZBkmcwIWa5zAsWNijsmb6TnxxsI6WIQMqce2HoIvlCm6f4EPUxszm6lMkBxzbQVduwwfDJtiYMQ
com.flyrobe.android			en	osprey_ud2	2016-11-19T10:04:17Z	1479549857475	2016-11-19T10:04:17Z	1479549857475	5		My mom wanted to rent a saree and searched on every renting sites but did not find anything good so I told her to try the flyrobes sites ad she got the prettiest saree and when the saree was delivered it looked exactly the way it was shown on the app . . Great app !				https://play.google.com/apps/publish?account=6499663341265583899#ReviewDetailsPlace:p=com.flyrobe.android&reviewid=gp:AOqpTOEmN2PYxoncVWxmI1LUw0rp783Cf7cXyaqiHci4khlc2DIBz72XT3JQvyK6ubRBPuV7TnR7GDhsH_owxg
com.flyrobe.android	31	2.2.0	en	mobee_msm8939_64	2016-11-19T10:04:16Z	1479549856661	2016-11-19T10:04:19Z	1479549859247	5		I only buy clothes from online shopping sites such as koovs , voonik but they never satisfied me , so i just thought of trying the flyrobes app and it turned out to be very good with its collection and the prices are also affordable and renting clothes which the celebrities wore is a dream come true thing !				https://play.google.com/apps/publish?account=6499663341265583899#ReviewDetailsPlace:p=com.flyrobe.android&reviewid=gp:AOqpTOEmTJfHjA4gxU0GIhqkXDL0nEmrWq_v7M7_ijXYyqNZyd8nwbFgDLHP5HBJKOZjShG9A_8rSP6F51cQUQ
com.flyrobe.android	31	2.2.0	en	X1Mini	2016-11-19T10:06:26Z	1479549986798	2016-11-19T10:06:26Z	1479549986798	5	Good aop	Want to wear designer clothes? Try the flyrobes app as they have awesome collections of clothes of various designers at very cheap prices . Great app for renting clothes .				https://play.google.com/apps/publish?account=6499663341265583899#ReviewDetailsPlace:p=com.flyrobe.android&reviewid=gp:AOqpTOGtIqW61CF9kTfK1W2hrV4kwljjkxw1xH_5s72ews22tZYnIIA1B2rAjoAXncETL48tiIPbYRuzjTtMtg
com.flyrobe.android	31	2.2.0	en	VIDEOCONZ55Dash	2016-11-19T10:06:54Z	1479550014485	2016-11-19T10:06:54Z	1479550014485	5		One of the best women shopping apps ! really loved the collection of this app . Renting clothes has become very easier because of this app .				https://play.google.com/apps/publish?account=6499663341265583899#ReviewDetailsPlace:p=com.flyrobe.android&reviewid=gp:AOqpTOEedMBjnIvNMc5-h0gnLZPmP2ZjLwWmfsObvsoNRI3-YCbOhxspeamOdLBXtQfzaBy8mZ3WfuahgInjOw
com.flyrobe.android	31	2.2.0	en	j7elte	2016-11-19T10:07:43Z	1479550063391	2016-11-19T10:07:45Z	1479550065448	5		I wanted to buy a tuxedo for my brother but we did not get any as the fittings were not proper . One of his friend's suggested us to try the flyrobes app and the tuxedo which we rented was so good with such good fitting that now we only rent clothes from flyrobe .				https://play.google.com/apps/publish?account=6499663341265583899#ReviewDetailsPlace:p=com.flyrobe.android&reviewid=gp:AOqpTOGDGx0m-0ke-dWjblQ3gl1Aq-fX8dqgzeBxR5xUJ3Eh6K2jqAdfoxEOlVwSrqUsYjQL_uz18IvEbd6Q-w
com.flyrobe.android	31	2.2.0	en	era1X	2016-11-19T10:03:39Z	1479549819299	2016-11-19T10:08:08Z	1479550088559	5		Flyrobes ! Amazing app with amazing quality of clothes . What else does a shopaholic need when we can rent clothes worn by celebrities . Great app !				https://play.google.com/apps/publish?account=6499663341265583899#ReviewDetailsPlace:p=com.flyrobe.android&reviewid=gp:AOqpTOHIBBNUWXg5GYjnOdh9jx1lBZj85hXuA3_wmNxxPktfGqKMv-fbtH8ohi6XBkdFiYYlvC5xxwvqGfW7xg
com.flyrobe.android	31	2.2.0	en	j13g	2016-11-19T10:08:55Z	1479550135005	2016-11-19T10:08:55Z	1479550135005	5		My dad wanted to wear a sherwani for his diwali party in office so he rented one from flyrobes and his experience was so good that now he suggests everyone to rent clothes from flyrobes .				https://play.google.com/apps/publish?account=6499663341265583899#ReviewDetailsPlace:p=com.flyrobe.android&reviewid=gp:AOqpTOE6Qw5vnDNfngWNYgOxo252gvBq-N4_F9tnEVJXmN7U1b8laRYAuat0Gq0OP67WBcI5a0B6Dz9OGdVVHw
com.flyrobe.android	31	2.2.0	en	HWY221-U	2016-11-19T10:09:38Z	1479550178790	2016-11-19T10:10:11Z	1479550211935	5		Dont have time to shop and dont want to put so much of money on clothes , then just rent some pretty looking dresses from flyrobes at very reasonable prices .				https://play.google.com/apps/publish?account=6499663341265583899#ReviewDetailsPlace:p=com.flyrobe.android&reviewid=gp:AOqpTOGk2dhF5nAMRmRQFoM23w2ks5SmfVc5GHvSh5IhVW4kh7mfmPlx3R45MFeNiunZq_4zFyOPUHAddRY32w
com.flyrobe.android	31	2.2.0	en	a5lte	2016-11-19T10:10:53Z	1479550253853	2016-11-19T10:10:53Z	1479550253853	5		Never thought of renting clothes as I was not very sure of the fiiting of the outfits but when I rented a lehenga from flyrobes I realised that renting clothes is such a good alternative if you dont have any dress to wear . Great app !				https://play.google.com/apps/publish?account=6499663341265583899#ReviewDetailsPlace:p=com.flyrobe.android&reviewid=gp:AOqpTOEglYNyj9VnN1dEkXdvItFfUdjUkSq20uhC2hq7jXwYjWIqJjDJvY1l4HAK-0_l1wrTggdOQspRh99frA
com.flyrobe.android			en	A7020a48	2016-11-19T10:11:19Z	1479550279606	2016-11-19T10:11:19Z	1479550279606	5		Tried buying clothes from roposo and my experience with them was awful . I had downloaded the flyrobes app and was happy with their services .				https://play.google.com/apps/publish?account=6499663341265583899#ReviewDetailsPlace:p=com.flyrobe.android&reviewid=gp:AOqpTOEvoudZRDhA8LH3lfaTpMHdeXiXTNd5R6V2VqhTN04qz305_rJexNVHMqf6zeXOq4PP3fU__Vcuu07yWg
com.flyrobe.android	31	2.2.0	en	e53g	2016-11-19T10:12:37Z	1479550357522	2016-11-19T10:12:37Z	1479550357522	5	Amazing designer outfits available on flyrobes ! Perfect for any occassion I would say . Would recommend it to all . Better than all the other women shopping apps	Amazing designer outfits available on flyrobes ! Perfect for any occassion I would say . Would recommend it to all . Better than all the other women shopping apps				https://play.google.com/apps/publish?account=6499663341265583899#ReviewDetailsPlace:p=com.flyrobe.android&reviewid=gp:AOqpTOErR3VaizVf9AYIR3ghtPXbO3zPl4Xt_Jrj6XvW9eC6eEcmaF2tKK8F2oAFrBLV1MWlGTeeUB3nbUa8Sg
com.flyrobe.android			en	Aqua_4G_Strong	2016-11-19T10:13:53Z	1479550433141	2016-11-19T10:13:53Z	1479550433141	5		I was recommended by a friend about flyrobes and I purchased a top which was very cute and pretty just like me :p The best part was I could get a dress for free on my next purchase as i was referred by a friend . amazing app for renting clothes .				https://play.google.com/apps/publish?account=6499663341265583899#ReviewDetailsPlace:p=com.flyrobe.android&reviewid=gp:AOqpTOF8v6gWPxn0d0SPB7wqgOMraJxSB1Dxq5TYUYYu2Hy01yZW6xWVHh43vdJ-9OyrMbrGEJ2B6fOC_hjyPQ
com.flyrobe.android	31	2.2.0	en	Y51L	2016-11-19T10:20:02Z	1479550802155	2016-11-19T10:20:02Z	1479550802155	5						
com.flyrobe.android	31	2.2.0	en	htc_a31mg_dug	2016-11-19T10:22:29Z	1479550949444	2016-11-19T10:22:29Z	1479550949444	5		Nice dresses				https://play.google.com/apps/publish?account=6499663341265583899#ReviewDetailsPlace:p=com.flyrobe.android&reviewid=gp:AOqpTOFzeEgntUs62WHlUThSQWaDrIlZVBD-r0Dj8baYm-4fQqjBg_Jdt_fJck03JkS8hmUVqZeeVNAtvFTJWA
com.flyrobe.android	31	2.2.0	en	C6902	2016-11-19T10:22:36Z	1479550956044	2016-11-19T10:22:36Z	1479550956044	5						
com.flyrobe.android	31	2.2.0	en	ms013g	2016-11-19T16:30:13Z	1479573013846	2016-11-19T16:32:32Z	1479573152342	1	What a App	What a fu...king app superb chutyapa Security deposit Rs 800. First time I have seen security deposit. First close ur ecommerce business. This is best idea from my side. Best option for u guys.. Now uninstall the app.. Thank for chutyapa...				https://play.google.com/apps/publish?account=6499663341265583899#ReviewDetailsPlace:p=com.flyrobe.android&reviewid=gp:AOqpTOFgHT0TgZ8LJ8rSUJkKTaVV8_Avovz12CjPO6tbdO4QqZIIHhpU2B8c4c_i5LiAoe3fB5VNZWr2yk8o8A
com.flyrobe.android			en	X2-AP	2016-11-20T07:11:51Z	1479625911783	2016-11-20T07:11:51Z	1479625911783	4						
com.flyrobe.android			en	j7elte	2016-11-20T07:39:50Z	1479627590644	2016-11-20T07:39:50Z	1479627590644	5						
com.flyrobe.android	31	2.2.0	en	lux_uds	2016-11-20T08:21:14Z	1479630074199	2016-11-20T08:21:14Z	1479630074199	2	Horrible Service	Well this was my first experience with them and I am sure it was the last. Despite making more than 15 calls to their customer care and getting assured that my outfit will be delivered on time, it wasn't. There was no follow up from the customer care team in respect of delivery time or reason for delay in delivery.After spending all morning and a better half of the afternoon with their customer care, I received the outfit 15 minutes before leaving for the railway station! Extremely disappointing.				https://play.google.com/apps/publish?account=6499663341265583899#ReviewDetailsPlace:p=com.flyrobe.android&reviewid=gp:AOqpTOHiLULse7NsXz10qjUH4G5b-jel4Y1SFtWRJr-ZqpQwF1YRFFtET-wmDwHjupDRWmjtQYDPixG-odFbnw
com.flyrobe.android			en	htc_hiaeuhl	2016-11-20T08:48:43Z	1479631723244	2016-11-20T08:48:43Z	1479631723244	3						
com.flyrobe.android			en	A6020a40	2016-11-20T12:50:17Z	1479646217993	2016-11-20T12:50:23Z	1479646223650	2						
com.flyrobe.android	31	2.2.0	en	Aqua Craze	2016-11-05T06:52:50Z	1478328770541	2016-11-20T16:12:32Z	1479658352474	5	if you like rental process services you should definitely try this one this one has a lot of great application services at one place	if you like rental process services you should definitely try this one this one has a lot of great application services at one place				https://play.google.com/apps/publish?account=6499663341265583899#ReviewDetailsPlace:p=com.flyrobe.android&reviewid=gp:AOqpTOGdKPa9oXgKgrKpNPGLcOhP_GiUi2CKCyElv_JXhnMH16u2gMBgI1N64SoMjg9Syl3u93SHOejad9MW4A
com.flyrobe.android	31	2.2.0	en	vivalto5mve3g	2016-11-20T16:14:23Z	1479658463893	2016-11-20T16:14:23Z	1479658463893	5		i must say there cab be any such other app which provides clothes on rent . great app .				https://play.google.com/apps/publish?account=6499663341265583899#ReviewDetailsPlace:p=com.flyrobe.android&reviewid=gp:AOqpTOGC3yPErHnDY0tTB504Re0TaxipqZzDQJGY4rH9YLbZgZIQP1EBZS0T4CbEduEtJjdgTx4lfJAU1srmqA
com.flyrobe.android			en	A33	2016-10-16T14:17:36Z	1476627456806	2016-11-20T16:17:15Z	1479658635250	5	Gud app	Faces also quite cool you can get anything that you want a very cheap prices				https://play.google.com/apps/publish?account=6499663341265583899#ReviewDetailsPlace:p=com.flyrobe.android&reviewid=gp:AOqpTOH6LqUH8_EkgWYgx1zgVkVjGtCXRL5k2k_prxuWYozHKMFz1hK8TXeF_1_caD4nM9cA1rHiyrvBRFmz4Q
com.flyrobe.android			en	Z00A_1	2016-11-20T16:17:21Z	1479658641204	2016-11-20T16:17:21Z	1479658641204	3		A big thanks to flyrobe for providing clothes on rent . great app . i recommend this app to all . it helped me big time with my marriage , my wedding gown was not ready and the wedding day was day after tomorrow . my brother suggested me to use flyrobe as he saw the same wedding gown on flyrbes and also the best part was , they provided it on rent . so it was a great help to me . thank you .				https://play.google.com/apps/publish?account=6499663341265583899#ReviewDetailsPlace:p=com.flyrobe.android&reviewid=gp:AOqpTOEKKRN0ocHWL4BWbP9zvgtNEq99TanV5VjS_8w0UYYIGJW3gZVRh9jv50AHUiPw9THAnMvHZ4Xg5vPSbQ
com.flyrobe.android			en	Q700S	2016-11-20T16:20:08Z	1479658808595	2016-11-20T16:20:08Z	1479658808595	5						
com.flyrobe.android	31	2.2.0	en	Y21	2016-11-20T16:20:44Z	1479658844970	2016-11-20T16:20:44Z	1479658844970	5		I have tried many online shopping sites like roposo , voonik , koovs but non of them made me happy and also the quality of the clpothes was not so good so i had to return it . then i just saw this app caled flyrobe on the pop ups add , so i just downloaded it and broowsed it a littl , i loved the idea of renting clothes as buying designer outfits is way too expensive , and they provided such outfits on rent , made it asy for me to wear one . It was really amazing to rent clothes from flyrobe .				https://play.google.com/apps/publish?account=6499663341265583899#ReviewDetailsPlace:p=com.flyrobe.android&reviewid=gp:AOqpTOEt-lnW3cQBDvAf5sPRfsqIe4DHDeAZftskMtzGvrT3s05MzE-DtqGsuAHys-ou3iCzKrtYjkWQcRRkHg
com.flyrobe.android	31	2.2.0	en	V23GB	2016-11-20T16:23:33Z	1479659013346	2016-11-20T16:23:33Z	1479659013346	5		i had once ordered a kurta on voonik , but the quality of the cloth was not as good as i expected , but then when i ordered the same on flyrobe and that to on rent , i was much satisfied seeing the quality of the cloth .				https://play.google.com/apps/publish?account=6499663341265583899#ReviewDetailsPlace:p=com.flyrobe.android&reviewid=gp:AOqpTOG3qebXP9d9EorLnhGrIyjd95fGNFHsQIP9ZEGCTsN-F9WppQ8VB3lqtSmjUANhSrPHNMn5RZqnRpvUGQ
com.flyrobe.android	31	2.2.0	en	ha3g	2016-11-20T16:27:16Z	1479659236623	2016-11-20T16:27:16Z	1479659236623	5		highly recommended to all the fashion lovers and brand conscious people , you will get all the clothes on rent and also wide range of choices . nice app . love it .				https://play.google.com/apps/publish?account=6499663341265583899#ReviewDetailsPlace:p=com.flyrobe.android&reviewid=gp:AOqpTOHFeRs5N1w2tOSskK6JObMaX3Fyx7bYAryatAUmj0fxY8D9lHCYS7losLTFA9rTg6l38WpW9EVv2vTP3w
com.flyrobe.android	31	2.2.0	en	HM2014818	2016-11-20T16:33:27Z	1479659607903	2016-11-20T16:33:27Z	1479659607903	5		have rented clothes online? ever tried flyrobe? do give it a try . best app .				https://play.google.com/apps/publish?account=6499663341265583899#ReviewDetailsPlace:p=com.flyrobe.android&reviewid=gp:AOqpTOFlfLp-YtLLSYANZ-CNquCHNueMiL0tmUTrC38HBvTNKN4AGpNS0UMr-TEc23vBGmcGge1BY7qIsJsjUQ
com.flyrobe.android	31	2.2.0	en	A6020a40	2016-11-20T16:25:24Z	1479659124991	2016-11-20T16:37:07Z	1479659827913	5		happy to see such an amazing collection of different clothing . and the best is i can have this just by paying a small amount of money . best app to provide clothes on rent .				https://play.google.com/apps/publish?account=6499663341265583899#ReviewDetailsPlace:p=com.flyrobe.android&reviewid=gp:AOqpTOEu9U_mCXfwrxE5ahB1s7fjL-1O-YmKWe0Gtmt1a6xy94wUZ3McFfBA1R5euZJHftPAiFYBRTvg_bepAg
